,Título,Nota,URL,Comentar,id,name,types,formatted_address,opening_hours,rating,website,user_ratings_total,price_level,address_components,reviews
28,Osteria Il Grattacielo dal 1840,,https://www.google.com/maps/place/Osteria+Il+Grattacielo+dal+1840/data=!4m2!3m1!1s0x132a2cb9d00eb1d1:0x3127c0b36fa0e06c,,ChIJ0bEO0LksKhMRbOCgb7PAJzE,Osteria Il Grattacielo dal 1840,"['restaurant', 'food', 'point_of_interest', 'establishment']","Via dei Pontani, 8 angolo, Via dei Termini, 44, 53100 Siena SI, Italy","['Monday: 12:00\u2009–\u20093:00\u202fPM, 7:30\u2009–\u200910:30\u202fPM', 'Tuesday: 12:00\u2009–\u20093:00\u202fPM, 7:30\u2009–\u200910:30\u202fPM', 'Wednesday: 12:00\u2009–\u20093:00\u202fPM, 7:30\u2009–\u200910:30\u202fPM', 'Thursday: 12:00\u2009–\u20093:00\u202fPM, 7:30\u2009–\u200910:30\u202fPM', 'Friday: 12:00\u2009–\u20093:00\u202fPM, 7:30\u2009–\u200911:00\u202fPM', 'Saturday: 12:00\u2009–\u20093:00\u202fPM, 7:30\u2009–\u200911:00\u202fPM', 'Sunday: 12:00\u2009–\u20093:30\u202fPM']",4.3,https://sites.google.com/view/ilgrattacielo1840/home-page,1255.0,1.0,"[{'long_name': '44', 'short_name': '44', 'types': ['street_number']}, {'long_name': 'Via dei Termini', 'short_name': 'Via dei Termini', 'types': ['route']}, {'long_name': 'Siena', 'short_name': 'Siena', 'types': ['locality', 'political']}, {'long_name': 'Siena', 'short_name': 'Siena', 'types': ['administrative_area_level_3', 'political']}, {'long_name': 'Provincia di Siena', 'short_name': 'SI', 'types': ['administrative_area_level_2', 'political']}, {'long_name': 'Toscana', 'short_name': 'Toscana', 'types': ['administrative_area_level_1', 'political']}, {'long_name': 'Italy', 'short_name': 'IT', 'types': ['country', 'political']}, {'long_name': '53100', 'short_name': '53100', 'types': ['postal_code']}]","[{'author_name': 'Sarah Marie Smith', 'author_url': 'https://www.google.com/maps/contrib/108808326109888418717/reviews', 'language': 'en', 'original_language': 'en', 'profile_photo_url': 'https://lh3.googleusercontent.com/a-/ALV-UjXRyo47KJeVJPzO3ySmfcwB7G0WJkMi8FvdVGFlBEU7TVEw0xM-=s128-c0x00000000-cc-rp-mo-ba2', 'rating': 5, 'relative_time_description': 'a month ago', 'text': 'If you want an authentic, home felt and heart felt experience come here!!!! It was recommended to us, we were treated so well. The staff are very personable and welcoming. I’ve never been somewhere with no printed menu, only a verbal one! 🤯🤯🤯 everything was homemade and fresh. Best charcuterie board I’ve had in my life ( and I’m a tough critic ) and the pasta felt like love in a dish! Do yourself a favour and check it out if you’re in the area. Highly, highly, HIGHLY recommend.', 'time': 1729103939, 'translated': False}, {'author_name': 'William Renz', 'author_url': 'https://www.google.com/maps/contrib/113767097938786392329/reviews', 'language': 'en', 'original_language': 'en', 'profile_photo_url': 'https://lh3.googleusercontent.com/a-/ALV-UjVpHmg8EhSslw_ALufbuG1baAoUD3E-mf4MjkDFwqTWr1TVGdWv=s128-c0x00000000-cc-rp-mo', 'rating': 5, 'relative_time_description': '7 months ago', 'text': 'Small and charming Tuscan restaurant. Nice husband and wife duo. No set menu, we got everything they had available that night. Everything was great. My wife tried several new foods on their antipasto course: pate, sardines and she enjoyed them. She even tried their tripa. My wife is predominately plant based, and their cooking opened her up to whole new culinary horizons. Next time we’re in Siena will be returning.', 'time': 1714044788, 'translated': False}, {'author_name': 'Lululalowa Pu', 'author_url': 'https://www.google.com/maps/contrib/117929963652174592550/reviews', 'language': 'en', 'original_language': 'en', 'profile_photo_url': 'https://lh3.googleusercontent.com/a/ACg8ocLXMsS1QotgFL3RQ_b9VAoDu9fu55AD_77dMA6SR-fI9AfI4w=s128-c0x00000000-cc-rp-mo', 'rating': 5, 'relative_time_description': '2 months ago', 'text': 'Amazing. Super simple, simple food, but mastered the art of making simple food perfect. Coming back!! 40€ for two main courses, 0.75l of wine and two desserts.', 'time': 1726513956, 'translated': False}, {'author_name': 'Gou Lemkuil', 'author_url': 'https://www.google.com/maps/contrib/102838865192491221113/reviews', 'language': 'en', 'original_language': 'en', 'profile_photo_url': 'https://lh3.googleusercontent.com/a-/ALV-UjWQeWscUEyr232iftgsiC06GNOpo8BgmJwjDbgzOvwpffcFp1U=s128-c0x00000000-cc-rp-mo-ba4', 'rating': 5, 'relative_time_description': 'a year ago', 'text': 'A must if you are in Siena. One of the coolest dining experiences Iv had. No menu, the chef just has food he can prepare that day and let’s you know. You can ask him to pair a course for you and he can give you a course based on what you prefer. I tried a authentic Tuscan dinner and it was great!', 'time': 1677619332, 'translated': False}, {'author_name': 'McKenna Warner', 'author_url': 'https://www.google.com/maps/contrib/114432310770693161132/reviews', 'language': 'en', 'original_language': 'en', 'profile_photo_url': 'https://lh3.googleusercontent.com/a-/ALV-UjXXyxKxflTQdEOzDLmXxcj2GRyOk0mtFjyZTOrrjVMzKOPOxAv2Kw=s128-c0x00000000-cc-rp-mo', 'rating': 5, 'relative_time_description': 'a year ago', 'text': 'By far the best meal we have had in all of Italy so far on our honeymoon. A true Italian experience! Table wine was fantastic and the meals were simplistic but exploding with flavor. The staff was very kind and accommodating for us only knowing a little Italian. I wish we had more than 1 day in Siena. Will come back again!', 'time': 1680219063, 'translated': False}]"
29,Fischi per Fiaschi,,https://www.google.com/maps/place/Fischi+per+Fiaschi/data=!4m2!3m1!1s0x132a2ca4c43aa9dd:0x2dd9a17227fc3d02,,ChIJ3ak6xKQsKhMRAj38J3Kh2S0,Fischi per Fiaschi,"['restaurant', 'food', 'point_of_interest', 'establishment']","Via S. Marco, 43, 53100 Siena SI, Italy","['Monday: Closed', 'Tuesday: Closed', 'Wednesday: Closed', 'Thursday: 11:30\u202fAM\u2009–\u20092:30\u202fPM, 6:30\u2009–\u20099:30\u202fPM', 'Friday: 11:30\u202fAM\u2009–\u20092:30\u202fPM, 6:30\u2009–\u20099:30\u202fPM', 'Saturday: 11:30\u202fAM\u2009–\u20092:30\u202fPM, 6:30\u2009–\u20099:30\u202fPM', 'Sunday: 11:30\u202fAM\u2009–\u20092:30\u202fPM']",4.6,http://www.facebook.com/FischiXFiaschi,542.0,2.0,"[{'long_name': '43', 'short_name': '43', 'types': ['street_number']}, {'long_name': 'Via San Marco', 'short_name': 'Via S. Marco', 'types': ['route']}, {'long_name': 'Siena', 'short_name': 'Siena', 'types': ['locality', 'political']}, {'long_name': 'Siena', 'short_name': 'Siena', 'types': ['administrative_area_level_3', 'political']}, {'long_name': 'Provincia di Siena', 'short_name': 'SI', 'types': ['administrative_area_level_2', 'political']}, {'long_name': 'Toscana', 'short_name': 'Toscana', 'types': ['administrative_area_level_1', 'political']}, {'long_name': 'Italy', 'short_name': 'IT', 'types': ['country', 'political']}, {'long_name': '53100', 'short_name': '53100', 'types': ['postal_code']}]","[{'author_name': 'Nate Lanzino', 'author_url': 'https://www.google.com/maps/contrib/112041342105495518700/reviews', 'language': 'en', 'original_language': 'en', 'profile_photo_url': 'https://lh3.googleusercontent.com/a-/ALV-UjVaUGZBjr58HiuXwIXDsXV6G5ohebLab4_NczuzhYE-G2VzWoDn=s128-c0x00000000-cc-rp-mo', 'rating': 5, 'relative_time_description': 'a month ago', 'text': 'BEST MEATBALLS WE’VE EVER HAD! Also get the ragu, both were exceptional. Great service and even better food. We also had no problem walking in and getting a table on a Saturday evening without a reservation. Can’t recommend enough. Very cozy family run spot!', 'time': 1728153672, 'translated': False}, {'author_name': 'Jenevieve Hornsby', 'author_url': 'https://www.google.com/maps/contrib/117245104286593329507/reviews', 'language': 'en', 'original_language': 'en', 'profile_photo_url': 'https://lh3.googleusercontent.com/a-/ALV-UjXIzDUgczsEXnXpp4mCy4dGK4j3iwDxXsPeRixppVzEYve1kZg=s128-c0x00000000-cc-rp-mo-ba5', 'rating': 5, 'relative_time_description': '7 months ago', 'text': 'Very kind and helpful service. They advised on ingredients and helped us choose the perfect dishes for our family. So delicious!', 'time': 1713976357, 'translated': False}, {'author_name': 'Simas Mažeika', 'author_url': 'https://www.google.com/maps/contrib/103962383536844541009/reviews', 'language': 'en', 'original_language': 'en', 'profile_photo_url': 'https://lh3.googleusercontent.com/a-/ALV-UjWV_Zut9GoH3RgdPOYTmt5cPGd5zKOiyc7XuuVqkLN44OcORBnD=s128-c0x00000000-cc-rp-mo', 'rating': 5, 'relative_time_description': '3 months ago', 'text': 'Italian restaurant further away from the crowds, mostly visited by the locals which is a good sign. We enjoyed a platter with a mix of local cured meats and cheeses and two pasta dishes, both were very tasty. Great place to visit for a delicious meal.', 'time': 1722152750, 'translated': False}, {'author_name': 'Mathew Sellick', 'author_url': 'https://www.google.com/maps/contrib/116571902457800153324/reviews', 'language': 'en', 'original_language': 'en', 'profile_photo_url': 'https://lh3.googleusercontent.com/a-/ALV-UjXxdLPurkNmBa5gEltutpfK01UBVq0ZMtH_w-lHeCF7fwuG4yBw=s128-c0x00000000-cc-rp-mo-ba3', 'rating': 5, 'relative_time_description': '4 months ago', 'text': 'Friendly, accomodating and great food.\nWe popped in for an early dinner ~6:30pm. We were seated outside at our request on the quiet street.\n\nThe waiter may have seen us struggling with some of our Italian translations and ran through the menu for us happily.\n\nWe ordered a few different antipasto & mains (mostly in Italian, but wouldn’t have mattered if we didn’t) and it didn’t disappoint. It felt very family run, with warm cosy environment.\n\nWould certainly recommend someone who likes a more quiet spot away from the hundreds of traveler’s.', 'time': 1721579645, 'translated': False}, {'author_name': 'Linda Fach', 'author_url': 'https://www.google.com/maps/contrib/100321323598632176384/reviews', 'language': 'en', 'original_language': 'en', 'profile_photo_url': 'https://lh3.googleusercontent.com/a-/ALV-UjVWHyFJIFQRxeU9zy2xME6_rHF64MFqDEbui7QicGg_AOzGuMBbZw=s128-c0x00000000-cc-rp-mo-ba4', 'rating': 5, 'relative_time_description': 'a year ago', 'text': ""Delicious food. From what I've seen and read they offer typical dishes from the area. The menu is small but everyone - including vegetarians - will find something.\nI went for the gnocchi with pesto di dragoncello (estragon) and ricotta salata (grated hard ricotta cheese) which was very pleasant and delicious.\nThe ladies serving the food are also happy to help you out in English. Oh and finish with an espresso, the coffee was also very nice."", 'time': 1694547199, 'translated': False}]"
30,Osteria Da Trombicche,,https://www.google.com/maps/place/Osteria+Da+Trombicche/data=!4m2!3m1!1s0x132a2cb9c737635d:0x5e93a2772574d07c,,ChIJXWM3x7ksKhMRfNB0JXeik14,Osteria Da Trombicche,"['restaurant', 'food', 'point_of_interest', 'establishment']","Via delle Terme, 66, 53100 Siena SI, Italy","['Monday: 12:00\u2009–\u20093:00\u202fPM, 7:00\u2009–\u20099:30\u202fPM', 'Tuesday: 12:00\u2009–\u20092:30\u202fPM, 7:00\u2009–\u20099:30\u202fPM', 'Wednesday: 12:00\u2009–\u20092:30\u202fPM, 7:00\u2009–\u20099:30\u202fPM', 'Thursday: 12:00\u2009–\u20092:30\u202fPM, 7:00\u2009–\u20099:30\u202fPM', 'Friday: 12:00\u2009–\u20092:30\u202fPM, 7:00\u2009–\u20099:30\u202fPM', 'Saturday: 12:00\u2009–\u20092:30\u202fPM, 7:00\u2009–\u20099:30\u202fPM', 'Sunday: 12:00\u2009–\u20093:00\u202fPM']",4.3,http://www.datrombicche.it/,858.0,1.0,"[{'long_name': '66', 'short_name': '66', 'types': ['street_number']}, {'long_name': 'Via delle Terme', 'short_name': 'Via delle Terme', 'types': ['route']}, {'long_name': 'Siena', 'short_name': 'Siena', 'types': ['locality', 'political']}, {'long_name': 'Siena', 'short_name': 'Siena', 'types': ['administrative_area_level_3', 'political']}, {'long_name': 'Provincia di Siena', 'short_name': 'SI', 'types': ['administrative_area_level_2', 'political']}, {'long_name': 'Toscana', 'short_name': 'Toscana', 'types': ['administrative_area_level_1', 'political']}, {'long_name': 'Italy', 'short_name': 'IT', 'types': ['country', 'political']}, {'long_name': '53100', 'short_name': '53100', 'types': ['postal_code']}]","[{'author_name': 'I A', 'author_url': 'https://www.google.com/maps/contrib/101487634066087910568/reviews', 'language': 'en', 'original_language': 'en', 'profile_photo_url': 'https://lh3.googleusercontent.com/a-/ALV-UjXM1Fb9LkfrAavDy3xJkqewMbfCsDRKwoImgqCl3qYxE54Gzuf6=s128-c0x00000000-cc-rp-mo-ba6', 'rating': 5, 'relative_time_description': '6 months ago', 'text': 'Excellent Tuscan restaurant in the heart of old town Siena. It offers a varied menu at a good price quality. Open kitchen concept/  Good service. Recommended.', 'time': 1715285699, 'translated': False}, {'author_name': 'Gianna Lian', 'author_url': 'https://www.google.com/maps/contrib/113261843852222767834/reviews', 'language': 'en', 'original_language': 'en', 'profile_photo_url': 'https://lh3.googleusercontent.com/a-/ALV-UjUlXP1jjVygsz_uaplaWDRhIvuwo_EtvYnmGFLCw6wdbJIwubTa=s128-c0x00000000-cc-rp-mo', 'rating': 5, 'relative_time_description': 'a year ago', 'text': 'amazing food. you need to get the coffee cake mousse!! the steak & potatoes are to die for. The pasta we got was so fresh and amazing quality. Highly recommend this place, it has that homey/local feel to it for sure!', 'time': 1695325905, 'translated': False}, {'author_name': 'Trevor Newman', 'author_url': 'https://www.google.com/maps/contrib/108555533867893505678/reviews', 'language': 'en', 'original_language': 'en', 'profile_photo_url': 'https://lh3.googleusercontent.com/a-/ALV-UjWPonN-Om8Zs8ZTdUf2ygkIL_6nwxp30C7fW7aWkZVyysYphbMe=s128-c0x00000000-cc-rp-mo-ba4', 'rating': 5, 'relative_time_description': 'a month ago', 'text': 'Funky cool eating place away from crowded streets. Great location, food & drinks selection, great service. Highly recommend.', 'time': 1727386600, 'translated': False}, {'author_name': 'James Vizzard', 'author_url': 'https://www.google.com/maps/contrib/109508958474116814940/reviews', 'language': 'en', 'original_language': 'en', 'profile_photo_url': 'https://lh3.googleusercontent.com/a-/ALV-UjV095NUWPbbeP2oEUnEcmSUGo6Imw6D4A4ZcvoWHs-zBLC3_9mLJg=s128-c0x00000000-cc-rp-mo', 'rating': 5, 'relative_time_description': '12 months ago', 'text': ""This is the farthest you can get from a tourist trap in Italy. Eight indoor tables and a staff of three with a tiny open kitchen. Bread arrives at the table in a brown paper sack. The wine list is long but we did very well with glasses of house red. We were the only English speaking customers on a Saturday afternoon. My wife had the tagliatelle with goat ragu and I had the beef tongue--both delicious and the perfect portion size. Prices are very reasonable. If we lived here we'd probably eat there every week."", 'time': 1700916868, 'translated': False}, {'author_name': 'Andrew Lian', 'author_url': 'https://www.google.com/maps/contrib/113954561218655021976/reviews', 'language': 'en', 'original_language': 'en', 'profile_photo_url': 'https://lh3.googleusercontent.com/a-/ALV-UjVeN5J-VPn0bzhqMouF9yhHBLLNXKbNrVKXXQGQIXlNrq_LtPvT=s128-c0x00000000-cc-rp-mo-ba6', 'rating': 5, 'relative_time_description': 'a year ago', 'text': 'Wow! What a great evening.  A recommendation from our lovely host and we weren’t disappointed. This is a locals spot. We really enjoyed the open kitchen and watching the the dishes get plated.', 'time': 1695502461, 'translated': False}]"
31,Agriturismo Castel di Pugna,,https://www.google.com/maps/place/Agriturismo+Castel+di+Pugna/data=!4m2!3m1!1s0x132bd3f8d5e2dce1:0xb42d156d3abf21b7,,ChIJjdM16WbTKxMRvMW8vDNV3nc,Val di Pugna,"['locality', 'political']","53100 Val di Pugna, Province of Siena, Italy",[],,,,,"[{'long_name': 'Val di Pugna', 'short_name': 'Val di Pugna', 'types': ['locality', 'political']}, {'long_name': 'Siena', 'short_name': 'Siena', 'types': ['administrative_area_level_3', 'political']}, {'long_name': 'Province of Siena', 'short_name': 'SI', 'types': ['administrative_area_level_2', 'political']}, {'long_name': 'Tuscany', 'short_name': 'Tuscany', 'types': ['administrative_area_level_1', 'political']}, {'long_name': 'Italy', 'short_name': 'IT', 'types': ['country', 'political']}, {'long_name': '53100', 'short_name': '53100', 'types': ['postal_code']}]",
32,La Ménagère,,https://www.google.com/maps/place/La+M%C3%A9nag%C3%A8re/data=!4m2!3m1!1s0x132a5402fd86b49f:0x71968d7af706f562,,ChIJn7SG_QJUKhMRYvUG93qNlnE,La Ménagère,"['restaurant', 'food', 'point_of_interest', 'establishment']","Via de' Ginori, 8/R, 50123 Firenze FI, Italy","['Monday: 8:00\u202fAM\u2009–\u20092:00\u202fAM', 'Tuesday: 8:00\u202fAM\u2009–\u20092:00\u202fAM', 'Wednesday: 8:00\u202fAM\u2009–\u20092:00\u202fAM', 'Thursday: 8:00\u202fAM\u2009–\u20092:00\u202fAM', 'Friday: 8:00\u202fAM\u2009–\u20092:00\u202fAM', 'Saturday: 8:00\u202fAM\u2009–\u20092:00\u202fAM', 'Sunday: 8:00\u202fAM\u2009–\u20092:00\u202fAM']",4.2,http://www.lamenagere.it/,6553.0,2.0,"[{'long_name': 'R', 'short_name': 'R', 'types': ['subpremise']}, {'long_name': '8', 'short_name': '8', 'types': ['street_number']}, {'long_name': ""Via de' Ginori"", 'short_name': ""Via de' Ginori"", 'types': ['route']}, {'long_name': 'Firenze', 'short_name': 'Firenze', 'types': ['locality', 'political']}, {'long_name': 'Firenze', 'short_name': 'Firenze', 'types': ['administrative_area_level_3', 'political']}, {'long_name': 'Città Metropolitana di Firenze', 'short_name': 'FI', 'types': ['administrative_area_level_2', 'political']}, {'long_name': 'Toscana', 'short_name': 'Toscana', 'types': ['administrative_area_level_1', 'political']}, {'long_name': 'Italy', 'short_name': 'IT', 'types': ['country', 'political']}, {'long_name': '50123', 'short_name': '50123', 'types': ['postal_code']}]","[{'author_name': 'Home Away From Home Ltd', 'author_url': 'https://www.google.com/maps/contrib/107801171528745144768/reviews', 'language': 'en', 'original_language': 'en', 'profile_photo_url': 'https://lh3.googleusercontent.com/a/ACg8ocIEPKArh5DYgR6_JIW8sYzhOs1xrkPKoYdYWji_e7uYvMz_uw=s128-c0x00000000-cc-rp-mo-ba3', 'rating': 5, 'relative_time_description': '4 months ago', 'text': 'The dinner experience here was much better than brunch - my review is for dinner. The food was high quality and full of flavour. I’d definitely recommend the pasta with scallop. The in house cocktails were really creative and excellent flavour and extremely well balanced (hello, no hangover). Very professional service. The set up is very pretty with a florist, extensive vase display and a selection of gifts you can buy.', 'time': 1720100774, 'translated': False}, {'author_name': 'Emilian Haas', 'author_url': 'https://www.google.com/maps/contrib/103926755075239620621/reviews', 'language': 'en', 'original_language': 'en', 'profile_photo_url': 'https://lh3.googleusercontent.com/a/ACg8ocL4DHlbCwG_AJmErweiUdYk6d6pwtJcssGyqfPmgmTcgkXfkw=s128-c0x00000000-cc-rp-mo', 'rating': 5, 'relative_time_description': '5 months ago', 'text': 'Upon entering the restaurant, one is immediately struck by the unique decor and furnishings. In the entrance area, along with beautiful and unique decorative items available for purchase, there are cozy sofas and armchairs, as well as a flower shop where florists create artistic bouquets. Each room in this restaurant is decorated in a different style.\n\nOne room features a long, rectangular space with large, long wooden tables where one can enjoy a cozy candlelit dinner. The walls are sparsely plastered to reveal as much of the original brickwork as possible. Along one wall of this room, a large shelf displays colorful glass candle holders, arranged by color, creating a decorative highlight. Another room at the head of the restaurant boasts a glass roof; in the center stand a grand piano and a large bonsai tree.\n\nIn addition to its thoughtful and stylish decor, the restaurant excels with its outstanding service and exquisite food. The tasting menus are meticulously designed, with each course perfectly complementing the others. The same attention to detail found in the decor is reflected in the dishes. The service, led by Vittorio and Simona, is attentive and friendly, making us feel very welcome and comfortable.\n\nLa Menagere is definitely worth a visit—whether for a warm breakfast or a smoothie in the morning, a drink at the bar in the bistro at lunchtime, or a stylish dinner in the evening.', 'time': 1717187593, 'translated': False}, {'author_name': 'F S', 'author_url': 'https://www.google.com/maps/contrib/111561750879047440378/reviews', 'language': 'en', 'original_language': 'en', 'profile_photo_url': 'https://lh3.googleusercontent.com/a/ACg8ocI1NHbj3_D_OAAumkp1tLVigCGW10JVvifDefOBJOJ954Hbxw=s128-c0x00000000-cc-rp-mo-ba3', 'rating': 5, 'relative_time_description': 'a month ago', 'text': 'Very neat concept of a store with a cafe inside! Great location and fun atmosphere! Extensive menu with a wide variety of drinks and food. Only downside was the service. Both times we went the service was very reactive versus proactive. Nonetheless I would still return and spend more time here.', 'time': 1727608936, 'translated': False}, {'author_name': 'Jennifer Manzo', 'author_url': 'https://www.google.com/maps/contrib/117695594093236632914/reviews', 'language': 'en', 'original_language': 'en', 'profile_photo_url': 'https://lh3.googleusercontent.com/a/ACg8ocKHBoIhquIL0enEc74aawmZ8vgLYg9JjQnfXcRf0rdi8AkBIQ=s128-c0x00000000-cc-rp-mo-ba4', 'rating': 5, 'relative_time_description': '6 months ago', 'text': 'I was on the fence about visiting La Ménagère due to somewhat mixed reviews, but I’m so glad I did because I had such a great experience! We stopped in early for coffee and breakfast, which were very good. Service was attentive and kind, especially from those working behind the counter area toward the front. The space is breathtakingly beautiful and the shop sells such pretty, unique items. I ended up purchasing something for myself and a gift for my sister. Even if you don’t end up eating here, it’s worth popping in to shop and admire the beauty of the space. Definitely one of my favorite places in Florence!', 'time': 1714866691, 'translated': False}, {'author_name': 'BM', 'author_url': 'https://www.google.com/maps/contrib/110944339269465768555/reviews', 'language': 'en', 'original_language': 'en', 'profile_photo_url': 'https://lh3.googleusercontent.com/a-/ALV-UjXKhSpOh2lhVEgtdnlEFbJARw2tXH56cLurk5S_swpii_4mxX6n0g=s128-c0x00000000-cc-rp-mo-ba2', 'rating': 3, 'relative_time_description': 'a month ago', 'text': 'La Menagerie is overrated in my opinion.\n\nWhile the ambiance is top-notch and definitely impressive, the food left much to be desired. The food itself was just okay, and it took far too long to be served. We ordered Avocado Toast, Eggs Benedict and Omelette.\n\nTo add to the disappointment, the coffee was never hot enough, which is frustrating.\n\nAlso, the food is quite expensive for the quality and service you get. I expected more, given the reputation and prices.', 'time': 1728645793, 'translated': False}]"
