,Título,Nota,URL,Comentar,id,name,types,formatted_address,opening_hours,rating,website,user_ratings_total,price_level,address_components,reviews
48,Mercadão das Flores,,https://www.google.com/maps/place/Mercad%C3%A3o+das+Flores/data=!4m2!3m1!1s0x94cef98ba9a7659d:0x5057da19039ff4aa,,ChIJnWWnqYv5zpQRqvSfAxnaV1A,Mercadão das Flores,"['point_of_interest', 'establishment']","Rua Hayden, 105 - Vila Leopoldina, São Paulo - SP, 05314-010, Brazil","['Monday: 7:00\u202fAM\u2009–\u20095:00\u202fPM', 'Tuesday: 7:00\u202fAM\u2009–\u20095:00\u202fPM', 'Wednesday: 7:00\u202fAM\u2009–\u20095:00\u202fPM', 'Thursday: 7:00\u202fAM\u2009–\u20095:00\u202fPM', 'Friday: 7:00\u202fAM\u2009–\u20095:00\u202fPM', 'Saturday: 8:00\u202fAM\u2009–\u20095:00\u202fPM', 'Sunday: 9:00\u202fAM\u2009–\u20093:00\u202fPM']",4.5,http://www.mercadaodasflores.com.br/,4459.0,,"[{'long_name': '105', 'short_name': '105', 'types': ['street_number']}, {'long_name': 'Rua Hayden', 'short_name': 'Rua Hayden', 'types': ['route']}, {'long_name': 'Vila Leopoldina', 'short_name': 'Vila Leopoldina', 'types': ['sublocality_level_1', 'sublocality', 'political']}, {'long_name': 'São Paulo', 'short_name': 'São Paulo', 'types': ['administrative_area_level_2', 'political']}, {'long_name': 'São Paulo', 'short_name': 'SP', 'types': ['administrative_area_level_1', 'political']}, {'long_name': 'Brazil', 'short_name': 'BR', 'types': ['country', 'political']}, {'long_name': '05314-010', 'short_name': '05314-010', 'types': ['postal_code']}]","[{'author_name': 'Joy H.', 'author_url': 'https://www.google.com/maps/contrib/100056498436330269883/reviews', 'language': 'en', 'original_language': 'en', 'profile_photo_url': 'https://lh3.googleusercontent.com/a-/ALV-UjUYCaT_l1NYqbUt905C-z6Im3kZSSMJa-ZT2F_GJ3AhJ5YvFmruGQ=s128-c0x00000000-cc-rp-mo-ba5', 'rating': 5, 'relative_time_description': '3 weeks ago', 'text': '“Fun” “Good Deals” “Food&Drinks Available”\n\nA little piece of haven in the concrete jungle of São Paulo. I appreciate the wide variety of seasonal cut flowers, plants, trees, vases, and garden supplies. The prices are mostly fair and much cheaper than what you find in independent stores outside. The trip is always worth it and I always accidentally bring more plants home than intended. The space is pretty big and can take up hours of time if you’re looking for something specific. Luckily there are food options available as well.', 'time': 1730142918, 'translated': False}, {'author_name': 'Ricardo Urresti', 'author_url': 'https://www.google.com/maps/contrib/113131960583505782452/reviews', 'language': 'en', 'original_language': 'en', 'profile_photo_url': 'https://lh3.googleusercontent.com/a-/ALV-UjVn3hIyrP-ifW5YdKZwYSl1RXz31Jl08qcuoioVfnZKiuP3xUigIw=s128-c0x00000000-cc-rp-mo-ba6', 'rating': 5, 'relative_time_description': '10 months ago', 'text': 'There are three large offerings: fresh flowers, decor plants and plant vases. For the plants and flowers, plenty of options and good prices. Vases offerings are great, prices are fair. There is a very small food court, a good cafe option. Paid parking is available.', 'time': 1705423101, 'translated': False}, {'author_name': 'Joe Fukuhara', 'author_url': 'https://www.google.com/maps/contrib/113312255934105685948/reviews', 'language': 'en', 'original_language': 'en', 'profile_photo_url': 'https://lh3.googleusercontent.com/a-/ALV-UjV-e3rn3pioZHNFc1c4E_FWjy5SyIhUGtUry-18sVI638y0iC1ctg=s128-c0x00000000-cc-rp-mo-ba5', 'rating': 4, 'relative_time_description': '3 years ago', 'text': 'The place is a big warehouse with many stands. There are flowers, gardening supplies, vases and decoration related to flowers.\nThere is a cafe and a small food court that sells appetizers like pastel, some fast food and a rolled ice cream.\nParking costs initially R$10/2 hours but there are too few parking spaces.\nAbout half of the stands spaces are still available.\nPrefer week days and non-holidays for visiting. Next week is mother’s day so the place was really crowded.\nFlower’s quality and  are really good compared to malls and other flower shops in São Paulo.', 'time': 1619900743, 'translated': False}, {'author_name': 'Gloria', 'author_url': 'https://www.google.com/maps/contrib/105803870927296224974/reviews', 'language': 'en', 'original_language': 'en', 'profile_photo_url': 'https://lh3.googleusercontent.com/a-/ALV-UjW7hb9oWgfRlk0IeZO1-sfqnidylGAQs-1P4mVLO-sIUrKiZjmo5Q=s128-c0x00000000-cc-rp-mo-ba6', 'rating': 5, 'relative_time_description': '2 years ago', 'text': ""It's a very well organized place where you can buy anything related to flowers and plants. Prices are good, there are places to eat as well. There's a parking, but it's also possible to park on the street."", 'time': 1640856243, 'translated': False}, {'author_name': 'Juan Tiberio', 'author_url': 'https://www.google.com/maps/contrib/101717250372946899097/reviews', 'language': 'en', 'original_language': 'en', 'profile_photo_url': 'https://lh3.googleusercontent.com/a/ACg8ocK8T3WD-q5RtZ5tZToJOhMWVDcoyON9oYjLS97DU3RQyLLA9g=s128-c0x00000000-cc-rp-mo-ba4', 'rating': 5, 'relative_time_description': 'a year ago', 'text': 'Great place to buy beautiful flowers, plants and all related stuff.', 'time': 1698156024, 'translated': False}]"
49,Squella Restaurant,,https://www.google.com/maps/place/Squella+Restaurant/data=!4m2!3m1!1s0x9662c5ab5cedf45b:0x271d8163732b3e39,,ChIJW_TtXKvFYpYROT4rc2OBHSc,Squella Restaurant,"['restaurant', 'food', 'point_of_interest', 'establishment']","Av. Ricardo Cumming 94, 8350575 Santiago, Región Metropolitana, Chile","['Monday: 12:30\u2009–\u200911:00\u202fPM', 'Tuesday: 12:30\u2009–\u200911:00\u202fPM', 'Wednesday: 12:30\u2009–\u200911:00\u202fPM', 'Thursday: 12:30\u2009–\u200911:00\u202fPM', 'Friday: 12:30\u2009–\u200911:00\u202fPM', 'Saturday: 12:30\u2009–\u200911:00\u202fPM', 'Sunday: 12:30\u2009–\u20095:30\u202fPM']",4.3,https://www.instagram.com/p/CnMyRouOGbn/?igshid=YmMyMTA2M2Y=,856.0,2.0,"[{'long_name': '94', 'short_name': '94', 'types': ['street_number']}, {'long_name': 'Avenida Ricardo Cumming', 'short_name': 'Av. Ricardo Cumming', 'types': ['route']}, {'long_name': 'Yungay', 'short_name': 'Yungay', 'types': ['neighborhood', 'political']}, {'long_name': 'Santiago', 'short_name': 'Santiago', 'types': ['locality', 'political']}, {'long_name': 'Santiago', 'short_name': 'Santiago', 'types': ['administrative_area_level_3', 'political']}, {'long_name': 'Santiago', 'short_name': 'Santiago', 'types': ['administrative_area_level_2', 'political']}, {'long_name': 'Región Metropolitana', 'short_name': 'Región Metropolitana', 'types': ['administrative_area_level_1', 'political']}, {'long_name': 'Chile', 'short_name': 'CL', 'types': ['country', 'political']}, {'long_name': '8350575', 'short_name': '8350575', 'types': ['postal_code']}]","[{'author_name': 'Mila P', 'author_url': 'https://www.google.com/maps/contrib/103943305083930828967/reviews', 'language': 'en', 'original_language': 'en', 'profile_photo_url': 'https://lh3.googleusercontent.com/a-/ALV-UjWkkF03NxC4uVXAq-CkzTxcrpiw2txyYsN2Eo23jdup7dflhIA=s128-c0x00000000-cc-rp-mo-ba5', 'rating': 5, 'relative_time_description': '3 months ago', 'text': 'I recently had the pleasure of dining at resto and it was an absolute delight! From the moment we walked in, the atmosphere was warm and inviting. The service was impeccable, with our waiter being attentive and knowledgeable about the menu.\n\nWe enjoyed a fantastic selection of seafood, including sea urchins, oysters, a delicious seafood soup, and perfectly seared scallops. Every dish was beautifully prepared and bursting with flavor. The seafood was incredibly fresh, and the flavors were perfectly balanced.\n\nI was particularly impressed with the value for money. For the quality of the food and the overall dining experience, the price was incredibly reasonable. We even managed to enjoy a bottle of wine and still came in under $100.\n\nI highly recommend this resto to anyone looking for a memorable seafood dining experience. You won’t be disappointed!', 'time': 1723418783, 'translated': False}, {'author_name': 'Samridha Kunwar', 'author_url': 'https://www.google.com/maps/contrib/102925864036745948945/reviews', 'language': 'en', 'original_language': 'en', 'profile_photo_url': 'https://lh3.googleusercontent.com/a-/ALV-UjVIKk2WrwHv_DH_oeMuElTKKYdcHM0HjFjOShG83Qc6bQ3eyZCq=s128-c0x00000000-cc-rp-mo-ba5', 'rating': 5, 'relative_time_description': '4 months ago', 'text': ""This restaurant was absolutely fantastic. Rustic and nestled in quite an inconspicuous location ( very unexpected). We were early so it was mostly empty but it felt very warm and inviting. The servers were absolutely top notch! The shellfish appetizer platter was very well presented and tasted very fresh. The Reinata and the Langoustine were both amazing and I'd give this place a 5+ stars if I could. The shrimp risotto was one of the best I've every had including those I've hat in most places in Italy ( unfortunately only been to touristic restaurants)! Will need to return on my next trip!"", 'time': 1721788993, 'translated': False}, {'author_name': 'M H', 'author_url': 'https://www.google.com/maps/contrib/112585369072913396025/reviews', 'language': 'en', 'original_language': 'en', 'profile_photo_url': 'https://lh3.googleusercontent.com/a/ACg8ocI-9rnS_Nzef41tAh3LJX0nDlnNaKB_urvqnR9bjG_dDlImbg=s128-c0x00000000-cc-rp-mo', 'rating': 5, 'relative_time_description': '4 years ago', 'text': 'The starters are so fresh, specially the oysters, yammmmmm! The octopus was full of flavor and the sauce was classic!! We received really good service from Gabriel, the recommended wine was also so tasty, he even showed us the pool where they keep all the seafood alive! We can only recommend!', 'time': 1577751761, 'translated': False}, {'author_name': 'Ming Ng', 'author_url': 'https://www.google.com/maps/contrib/114678144404618161027/reviews', 'language': 'en', 'original_language': 'en', 'profile_photo_url': 'https://lh3.googleusercontent.com/a/ACg8ocKd_hPRvEf3SOwWSuLaVUdrCm3ns5nKmgpFSi7iHjwddKs68g=s128-c0x00000000-cc-rp-mo', 'rating': 4, 'relative_time_description': '9 months ago', 'text': ""Though not on the top 10 when I googled 'best seafood restaurant in Santiago', Squella deserves one of the best comparing with my dining experience in Hong Kong, Sydney, Bacelona and London where good seafood is famous. A cozy rooftop dining area with slight sunset view and nice breeze, and beautifully chosen music provide guests with a pleasant atmosphere. We chose octopus, crab cake and grilled lobster. All are fresh, well marinated and skillfully cooked. Hassen served us in a friendly , professional and patient way. (Our coummication via translation app makes great fun). Best of the best, the price is very reasonable--which is high 'price-quality rate' in Chinese. Highly recommend! Will rate 5 in service if the they could provide English menu."", 'time': 1707439126, 'translated': False}, {'author_name': 'VC L', 'author_url': 'https://www.google.com/maps/contrib/106503302894527227802/reviews', 'language': 'en', 'original_language': 'en', 'profile_photo_url': 'https://lh3.googleusercontent.com/a/ACg8ocLeoh6OgfWba6d7MMf84ZxALI8x1qx7FEz893Drfi1vaI0PbA=s128-c0x00000000-cc-rp-mo', 'rating': 1, 'relative_time_description': 'a year ago', 'text': ""I had a disappointing experience at this restaurant. While the food and service were good, I was shocked to find that they allowed smoking in a closed space. This completely ruined the otherwise pleasant atmosphere and made it impossible to enjoy my meal. I strongly believe that indoor smoking should not be allowed, and until this policy changes, I won't be returning to this establishment."", 'time': 1694222544, 'translated': False}]"
50,Plaza Garibaldi,,https://www.google.com/maps/place/Plaza+Garibaldi/data=!4m2!3m1!1s0x9662c5ab5ba86df7:0x2c6d7eb1499fc53d,,ChIJH3x1xy750YUR90qP2ipcKeQ,Plaza Garibaldi,"['point_of_interest', 'tourist_attraction', 'establishment']","Eje Central Lázaro Cárdenas 43, Centro, Cuauhtémoc, 06010 Ciudad de México, CDMX, Mexico","['Monday: Open 24 hours', 'Tuesday: Open 24 hours', 'Wednesday: Open 24 hours', 'Thursday: Open 24 hours', 'Friday: Open 24 hours', 'Saturday: Open 24 hours', 'Sunday: Open 24 hours']",4.2,https://mexicocity.cdmx.gob.mx/venues/garibaldi-plaza/?lang=es,41818.0,,"[{'long_name': '43', 'short_name': '43', 'types': ['street_number']}, {'long_name': 'Eje Central Lázaro Cárdenas', 'short_name': 'Eje Central Lázaro Cárdenas', 'types': ['route']}, {'long_name': 'Centro', 'short_name': 'Centro', 'types': ['sublocality_level_1', 'sublocality', 'political']}, {'long_name': 'Ciudad de México', 'short_name': 'México D.F.', 'types': ['locality', 'political']}, {'long_name': 'Ciudad de México', 'short_name': 'CDMX', 'types': ['administrative_area_level_1', 'political']}, {'long_name': 'Mexico', 'short_name': 'MX', 'types': ['country', 'political']}, {'long_name': '06010', 'short_name': '06010', 'types': ['postal_code']}]","[{'author_name': 'Keren Amaya S', 'author_url': 'https://www.google.com/maps/contrib/116274254452173456709/reviews', 'language': 'en', 'original_language': 'en', 'profile_photo_url': 'https://lh3.googleusercontent.com/a-/ALV-UjWjspK5IdrBWZYi4DC5iuqSPoqGt5XpEV2_aXyvprvkcYOkkjcvAw=s128-c0x00000000-cc-rp-mo-ba8', 'rating': 5, 'relative_time_description': '4 months ago', 'text': ""Signature place to visit while in Mexico city. Enjoy mariachi bands and places around with live shows and typical dance. San Camilito food market is right next and it's a must , delicious tacos, the best birria place inside as well.\nCareful when exploring the surrounding areas as it can be dangerous."", 'time': 1721830207, 'translated': False}, {'author_name': 'Louise Borg', 'author_url': 'https://www.google.com/maps/contrib/112911853665381229466/reviews', 'language': 'en', 'original_language': 'en', 'profile_photo_url': 'https://lh3.googleusercontent.com/a-/ALV-UjXW3YoQtRSnL6dSrftCznw3yk2Sm5YWWx8ViMh7-0b9LROb9DGqWQ=s128-c0x00000000-cc-rp-mo-ba7', 'rating': 4, 'relative_time_description': '5 months ago', 'text': ""We were here in the afternoon on a Saturday and there were lots of mariachi singers but no one was playing anything. You have to request it and I don't know how much it cost"", 'time': 1718491858, 'translated': False}, {'author_name': 'Annabel Perez', 'author_url': 'https://www.google.com/maps/contrib/106537347464633281147/reviews', 'language': 'en', 'original_language': 'en', 'profile_photo_url': 'https://lh3.googleusercontent.com/a-/ALV-UjXV1vb2V62M2d23h197yXHfJfXjMcLdjIUEKuveU6L8-q39ekdq=s128-c0x00000000-cc-rp-mo-ba3', 'rating': 5, 'relative_time_description': '2 months ago', 'text': 'I went on a Friday night, great atmosphere,  lots of restaurants, great music, food & the people are very attentive, bring the family & your friends.', 'time': 1726917384, 'translated': False}, {'author_name': 'Luis Sanchez', 'author_url': 'https://www.google.com/maps/contrib/103650223761169239349/reviews', 'language': 'en', 'original_language': 'en', 'profile_photo_url': 'https://lh3.googleusercontent.com/a-/ALV-UjWEhRjhK40Q3I326NK_sZbUqZOYaaaW5koZX7qd14-YmIyJaOAv=s128-c0x00000000-cc-rp-mo-ba4', 'rating': 5, 'relative_time_description': '5 months ago', 'text': 'Great environmental to be in very traditional. Plenty of mariachi bands in this plaza. You can hire a group of people for a song or a full hour. Highly recommend coming here when there is a lot of people walking around.', 'time': 1719209574, 'translated': False}, {'author_name': 'Miguel Arjona', 'author_url': 'https://www.google.com/maps/contrib/114749672947285064309/reviews', 'language': 'en', 'original_language': 'en', 'profile_photo_url': 'https://lh3.googleusercontent.com/a-/ALV-UjUEOlKNn-IEK1DQdKN0mbmiCcA1pJbaN7goiVb0JXeHvYDg8oESSg=s128-c0x00000000-cc-rp-mo-ba4', 'rating': 5, 'relative_time_description': '4 months ago', 'text': 'Variety of food within the market. In the main square there are a variety of mariachi and other groups playing throughout the night.', 'time': 1720789302, 'translated': False}]"
51,Madera & Carbón,,https://www.google.com/maps/place/Madera+%26+Carb%C3%B3n/data=!4m2!3m1!1s0x9662c5ab3b7c7a57:0xb2d453533d791797,,ChIJFfxh79OnMI4R3-hGeotAkKQ,Carbon y Madera,"['restaurant', 'food', 'point_of_interest', 'establishment']","Cra. 1B #58a 106, Barranquilla, Cali, Valle del Cauca, Colombia","['Monday: 11:00\u202fAM\u2009–\u20093:30\u202fPM', 'Tuesday: 11:00\u202fAM\u2009–\u20093:30\u202fPM', 'Wednesday: 11:00\u202fAM\u2009–\u20093:30\u202fPM', 'Thursday: 11:00\u202fAM\u2009–\u200911:00\u202fPM', 'Friday: 11:00\u202fAM\u2009–\u200911:00\u202fPM', 'Saturday: 11:00\u202fAM\u2009–\u200911:00\u202fPM', 'Sunday: 11:00\u202fAM\u2009–\u200911:00\u202fPM']",4.8,,85.0,,"[{'long_name': '58a 106', 'short_name': '58a 106', 'types': ['street_number']}, {'long_name': 'Carrera 1B', 'short_name': 'Cra. 1B', 'types': ['route']}, {'long_name': 'Torres de Comfandi', 'short_name': 'Torres de Comfandi', 'types': ['neighborhood', 'political']}, {'long_name': 'Barranquilla', 'short_name': 'Barranquilla', 'types': ['sublocality_level_1', 'sublocality', 'political']}, {'long_name': 'Cali', 'short_name': 'Cali', 'types': ['locality', 'political']}, {'long_name': 'Cali', 'short_name': 'Cali', 'types': ['administrative_area_level_2', 'political']}, {'long_name': 'Valle del Cauca', 'short_name': 'Valle del Cauca', 'types': ['administrative_area_level_1', 'political']}, {'long_name': 'Colombia', 'short_name': 'CO', 'types': ['country', 'political']}, {'long_name': '760002', 'short_name': '760002', 'types': ['postal_code']}]","[{'author_name': 'Jefferson', 'author_url': 'https://www.google.com/maps/contrib/113501973483339656836/reviews', 'language': 'en-US', 'original_language': 'es', 'profile_photo_url': 'https://lh3.googleusercontent.com/a-/ALV-UjV_A4JEaD6LtOi6Hhr4GGLZ4uB6QP9oiT7qNRJZIsIuCrd3WHA_=s128-c0x00000000-cc-rp-mo-ba5', 'rating': 4, 'relative_time_description': '11 months ago', 'text': ""Good place for a delicious lunch at a good price.\nFor dinner the food was delicious, good portion and good price. Since it's new management, the menu is just being built, but what there is is very good. There would be no hamburgers."", 'time': 1702177223, 'translated': True}, {'author_name': 'Camilo Noreña Agudelo', 'author_url': 'https://www.google.com/maps/contrib/108052797649074215417/reviews', 'language': 'en-US', 'original_language': 'es', 'profile_photo_url': 'https://lh3.googleusercontent.com/a-/ALV-UjXuZ4wG4B-X90SE9kWD4y5AQ-4NsVjnpVZUCFxCRCNc6nZsRT0f=s128-c0x00000000-cc-rp-mo-ba4', 'rating': 5, 'relative_time_description': '2 months ago', 'text': 'Excellent products and services 👌🏻', 'time': 1726981477, 'translated': True}, {'author_name': 'Enyimar Alvarez', 'author_url': 'https://www.google.com/maps/contrib/112117968899501838852/reviews', 'language': 'en-US', 'original_language': 'es', 'profile_photo_url': 'https://lh3.googleusercontent.com/a-/ALV-UjUJEdfJkmYGI5MDHepVYVgIkWFNWzDWxzLBTkuMTpVYeZAcTJGLrQ=s128-c0x00000000-cc-rp-mo', 'rating': 5, 'relative_time_description': '2 years ago', 'text': 'Excellent service, very good food and very good attention', 'time': 1652764341, 'translated': True}, {'author_name': 'Rafael Ramirez', 'author_url': 'https://www.google.com/maps/contrib/112936194714656028034/reviews', 'language': 'en-US', 'original_language': 'es', 'profile_photo_url': 'https://lh3.googleusercontent.com/a/ACg8ocLy7ChLw_IMXcPpjZ2nsYK2oQfFVwkCTLmOFdUCEP7piLudUQ=s128-c0x00000000-cc-rp-mo', 'rating': 5, 'relative_time_description': '5 years ago', 'text': 'It is the most beautiful and well attended restaurant in the North of Cali......delicious homemade food and the cabon roasts are very delicious......', 'time': 1549315742, 'translated': True}, {'author_name': 'Alexander Escobar', 'author_url': 'https://www.google.com/maps/contrib/111946813568325446175/reviews', 'language': 'en-US', 'original_language': 'es', 'profile_photo_url': 'https://lh3.googleusercontent.com/a-/ALV-UjWPFQAgg72o0tKy3_5xweZQ_N51B0KAwnxeHxfEuTR691U1g7DqLQ=s128-c0x00000000-cc-rp-mo', 'rating': 5, 'relative_time_description': '5 years ago', 'text': 'Very good service, a very nice place and excellent food', 'time': 1547433906, 'translated': True}]"
52,Beth Bakery,,https://www.google.com/maps/place/Beth+Bakery/data=!4m2!3m1!1s0x94ce59833d9cf2c3:0x1fecfe4a44e07099,,ChIJw_KcPYNZzpQRmXDgREr-7B8,Beth Bakery,"['bakery', 'cafe', 'food', 'point_of_interest', 'store', 'establishment']","Rua Paula Ney, 298 - Vila Mariana, São Paulo - SP, 04107-020, Brazil","['Monday: Closed', 'Tuesday: 9:00\u202fAM\u2009–\u20097:00\u202fPM', 'Wednesday: 9:00\u202fAM\u2009–\u20097:00\u202fPM', 'Thursday: 9:00\u202fAM\u2009–\u20097:00\u202fPM', 'Friday: 9:00\u202fAM\u2009–\u20097:00\u202fPM', 'Saturday: 9:00\u202fAM\u2009–\u20097:00\u202fPM', 'Sunday: Closed']",4.7,http://www.bethbakery.com.br/,1346.0,2.0,"[{'long_name': '298', 'short_name': '298', 'types': ['street_number']}, {'long_name': 'Rua Paula Ney', 'short_name': 'Rua Paula Ney', 'types': ['route']}, {'long_name': 'Vila Mariana', 'short_name': 'Vila Mariana', 'types': ['sublocality_level_1', 'sublocality', 'political']}, {'long_name': 'São Paulo', 'short_name': 'São Paulo', 'types': ['administrative_area_level_2', 'political']}, {'long_name': 'São Paulo', 'short_name': 'SP', 'types': ['administrative_area_level_1', 'political']}, {'long_name': 'Brazil', 'short_name': 'BR', 'types': ['country', 'political']}, {'long_name': '04107-020', 'short_name': '04107-020', 'types': ['postal_code']}]","[{'author_name': 'Jacob Fraczek', 'author_url': 'https://www.google.com/maps/contrib/115652083266671621749/reviews', 'language': 'en', 'original_language': 'en', 'profile_photo_url': 'https://lh3.googleusercontent.com/a/ACg8ocL0NDwg6K-nBg4Eh9vsAPgqxxjV7ev7hX3GABAm-5DYB8rWow=s128-c0x00000000-cc-rp-mo-ba4', 'rating': 5, 'relative_time_description': '3 weeks ago', 'text': ""I think this is a nice business, and all the food looks amazing, but ... There's a few issues.  One is, I asked if they had cafe gelado. Then I asked for this same cafe gelado preto (repeatedly) and then they gave me a mixed lemon cha coffee with sugar? Their payment system is a little weird.  It beeps, and they present your order at a door. And there's no clear mention of where your pan is returned.  You throw away trash yourself (which is fine). You don't pay up front and you have to figure all this out yourself. Not a good place for when it's raining. They had a staff member acting as security or something out front the whole time. I think they just need a new location, nobody seems very happy."", 'time': 1729967101, 'translated': False}, {'author_name': 'Ezequiel Rodríguez', 'author_url': 'https://www.google.com/maps/contrib/111680102101295307451/reviews', 'language': 'en', 'original_language': 'en', 'profile_photo_url': 'https://lh3.googleusercontent.com/a-/ALV-UjXSoZ3fLIiMe1bZHNdvHUOs62QLkzEaDBdPxfuVQMHNvShmd8vp=s128-c0x00000000-cc-rp-mo', 'rating': 5, 'relative_time_description': 'a month ago', 'text': ""Bakery with high-quality homemade products. I've tried all the sandwiches, and they never disappoint. Lovely atmosphere and friendly service."", 'time': 1727794261, 'translated': False}, {'author_name': 'Lewis Gibbs', 'author_url': 'https://www.google.com/maps/contrib/106017892717962043763/reviews', 'language': 'en', 'original_language': 'en', 'profile_photo_url': 'https://lh3.googleusercontent.com/a-/ALV-UjUu4349oTlN2tIL12TcnDhSn2kqAc6hVSCtUNPuo8yML_jYsJ3I=s128-c0x00000000-cc-rp-mo', 'rating': 5, 'relative_time_description': '10 months ago', 'text': ""Really awesome slice of relaxing vibes and great food. The smell of fresh baked goods as you enter is devine. Lovely outdoor sitting area. My partner frequents Beth's a lot and as I'm in SP for a short while visiting her, I was excited to experience it. Back again tomorrow!"", 'time': 1705606599, 'translated': False}, {'author_name': 'Victor Farsette', 'author_url': 'https://www.google.com/maps/contrib/117121422611160958404/reviews', 'language': 'en', 'original_language': 'en', 'profile_photo_url': 'https://lh3.googleusercontent.com/a-/ALV-UjVuxRovS5QFtOvNmRwwIaRFeShm7vBWGTZpGx63mxPgceyhSKn-nQ=s128-c0x00000000-cc-rp-mo-ba4', 'rating': 5, 'relative_time_description': '4 years ago', 'text': ""what a pastrami sandwich! beside my house, very intimist, fair price and super tasty. for sure I'll eat there again. I highly recommend this place!"", 'time': 1579446210, 'translated': False}, {'author_name': 'Gustavo Chofra', 'author_url': 'https://www.google.com/maps/contrib/101623432078792956619/reviews', 'language': 'en', 'original_language': 'en', 'profile_photo_url': 'https://lh3.googleusercontent.com/a-/ALV-UjUsV9kAfLZolzd-C9aahinOCpRYuuVULhcv3UrrCvV2BnDy8BPD=s128-c0x00000000-cc-rp-mo-ba5', 'rating': 5, 'relative_time_description': '2 years ago', 'text': ""One of the coolest spot in the neighborhood, this bakery delivers a killing cookie, an awesome sort of dough and breads, delicious scrabbled eggs served by an ultra-uber-amazing crew.\n\nBeth, the name on the sign and business owner and her husband are always around helping and baking fresh new ideas for sandwiches, pies and other gluten filled pieces of love made bread.\n\nGo and taste for yourself. It's worth the weekend lines to get some."", 'time': 1642341327, 'translated': False}]"
