,Título,Nota,URL,Comentar,id,name,types,formatted_address,opening_hours,rating,website,user_ratings_total,price_level,address_components,reviews
14,Dr. Martens,,https://www.google.com/maps/place/Dr.+Martens/data=!4m2!3m1!1s0x4786c709f0c8044f:0x5e6ad653db8a847,,ChIJ73ICE1FYzpQRQFUC7-Oz2VM,Slum Brand,"['clothing_store', 'point_of_interest', 'store', 'establishment']","R. Dr. Virgílio de Carvalho Pinto, 74 - Pinheiros, São Paulo - SP, 05415-020, Brazil","['Monday: 10:30\u202fAM\u2009–\u20097:00\u202fPM', 'Tuesday: 10:30\u202fAM\u2009–\u20097:00\u202fPM', 'Wednesday: 10:30\u202fAM\u2009–\u20097:00\u202fPM', 'Thursday: 10:30\u202fAM\u2009–\u20097:00\u202fPM', 'Friday: 10:30\u202fAM\u2009–\u20097:00\u202fPM', 'Saturday: 10:00\u202fAM\u2009–\u20096:00\u202fPM', 'Sunday: Closed']",4.5,http://www.slum.com.br/,85.0,,"[{'long_name': '74', 'short_name': '74', 'types': ['street_number']}, {'long_name': 'Rua Doutor Virgílio de Carvalho Pinto', 'short_name': 'R. Dr. Virgílio de Carvalho Pinto', 'types': ['route']}, {'long_name': 'Pinheiros', 'short_name': 'Pinheiros', 'types': ['sublocality_level_1', 'sublocality', 'political']}, {'long_name': 'São Paulo', 'short_name': 'São Paulo', 'types': ['administrative_area_level_2', 'political']}, {'long_name': 'São Paulo', 'short_name': 'SP', 'types': ['administrative_area_level_1', 'political']}, {'long_name': 'Brazil', 'short_name': 'BR', 'types': ['country', 'political']}, {'long_name': '05415-020', 'short_name': '05415-020', 'types': ['postal_code']}]","[{'author_name': 'king r&b', 'author_url': 'https://www.google.com/maps/contrib/102949679307657897236/reviews', 'language': 'en', 'original_language': 'en', 'profile_photo_url': 'https://lh3.googleusercontent.com/a-/ALV-UjW2Hu-g54wZ10lM3yPE8jBnPhv5VPQeQ9tvZasgSmasJ7HWnB2Q=s128-c0x00000000-cc-rp-mo-ba3', 'rating': 5, 'relative_time_description': '4 years ago', 'text': 'Top', 'time': 1594578055, 'translated': False}, {'author_name': 'RAYCA NEW ERA', 'author_url': 'https://www.google.com/maps/contrib/107566476374983348368/reviews', 'language': 'pt', 'original_language': 'pt', 'profile_photo_url': 'https://lh3.googleusercontent.com/a-/ALV-UjVhx9JO6UELNEwnRBGKpHpuPOuD32IekTMRtJEp1zrkaJ_Xs4Q=s128-c0x00000000-cc-rp-mo', 'rating': 5, 'relative_time_description': '2 months ago', 'text': 'A loja é incrível, a marca é excepcional…e o atendimento foi excelente 👏🏻\nMurilo além de ser muito querido e gente boa, nos deu uma aula 👏🏻\nParabéns vocês são demais\nVoltamos para curitiba com as nossas botinhas incríveis e com o coração quentinho 🤘🏻🫶🏻', 'time': 1724704046, 'translated': False}, {'author_name': 'Vitor Hugo Ferreira', 'author_url': 'https://www.google.com/maps/contrib/112794948955029141825/reviews', 'language': 'pt', 'original_language': 'pt', 'profile_photo_url': 'https://lh3.googleusercontent.com/a/ACg8ocLTWBns-rgR7OWHJl_amQZ_GoBQ51KMC8ICwfUwk8Q-n4LRTQ=s128-c0x00000000-cc-rp-mo', 'rating': 1, 'relative_time_description': '7 months ago', 'text': 'Adquiri uma bota “chelsea” roxa com esta marca, e foi uma grande decepção. Com pouco tempo de uso, nem 10 vezes, o soldado de ambos os pés descosturou totalmente, me deixando descalço no meio de um evento.\nLevada para “análise”, ao invés de substituirem o calçado foi recolocado solado, e se percebe diferença no tamanho dos pés, fora o desconforto e aperto em um deles. Não recomendo a compra a ninguém.', 'time': 1712074637, 'translated': False}, {'author_name': 'Isabelle Almeida', 'author_url': 'https://www.google.com/maps/contrib/107049759866584617490/reviews', 'language': 'pt', 'original_language': 'pt', 'profile_photo_url': 'https://lh3.googleusercontent.com/a-/ALV-UjWeDAKoCY1ZwVTIwE0mvUx3I5PjLxMmUfYcjSjp4s7_tcUFwK2nLA=s128-c0x00000000-cc-rp-mo-ba3', 'rating': 5, 'relative_time_description': '4 years ago', 'text': 'Visitei a loja para finalmente adquirir um coturno muito bonito. A atendente foi super gentil, explicou tudo direitinho sobre como cuidar do produto e achei muito legal essa atenção, sem contar a variedade de sapatos incríveis. Fiquei encantada. Espero em breve retornar.', 'time': 1604446728, 'translated': False}, {'author_name': 'M&I Local Guide', 'author_url': 'https://www.google.com/maps/contrib/113764296671197525448/reviews', 'language': 'pt', 'original_language': 'pt', 'profile_photo_url': 'https://lh3.googleusercontent.com/a-/ALV-UjW3pVEfFR6wvB2jfnOwaiEwAF_7FY3s_9-Ag969iPGySzyO_KeB=s128-c0x00000000-cc-rp-mo-ba4', 'rating': 5, 'relative_time_description': '3 years ago', 'text': 'Marca incrível para quem gosta ou precisa comprar um coturno de boa qualidade. Tem grande variedades de modelos e marcas, assim como Dr. Martins original.\nRecomendo! 🥾', 'time': 1633207806, 'translated': False}]"
15,SAPORI & DINTORNI STORE,,https://www.google.com/maps/place/SAPORI+%26+DINTORNI+STORE/data=!4m2!3m1!1s0x133b085515daa667:0xfb8fea2f759fb01b,,ChIJEciBNwJUKhMRd2jclksddmU,SAPORI & DINTORNI STORE,"['supermarket', 'grocery_or_supermarket', 'food', 'store', 'point_of_interest', 'establishment']","Borgo S. Lorenzo, 15/17, 50123 Firenze FI, Italy","['Monday: 8:00\u202fAM\u2009–\u20099:00\u202fPM', 'Tuesday: 8:00\u202fAM\u2009–\u20099:00\u202fPM', 'Wednesday: 8:00\u202fAM\u2009–\u20099:00\u202fPM', 'Thursday: 8:00\u202fAM\u2009–\u20099:00\u202fPM', 'Friday: 8:00\u202fAM\u2009–\u20099:00\u202fPM', 'Saturday: 8:00\u202fAM\u2009–\u20099:00\u202fPM', 'Sunday: 9:00\u202fAM\u2009–\u20099:00\u202fPM']",4.1,https://www.conad.it/ricerca-negozi/sapori--dintorni-store-borgo-san-lorenzo-15-17-50123-firenze--008920,934.0,,"[{'long_name': '17', 'short_name': '17', 'types': ['subpremise']}, {'long_name': '15', 'short_name': '15', 'types': ['street_number']}, {'long_name': 'Borgo San Lorenzo', 'short_name': 'Borgo S. Lorenzo', 'types': ['route']}, {'long_name': 'Firenze', 'short_name': 'Firenze', 'types': ['locality', 'political']}, {'long_name': 'Firenze', 'short_name': 'Firenze', 'types': ['administrative_area_level_3', 'political']}, {'long_name': 'Città Metropolitana di Firenze', 'short_name': 'FI', 'types': ['administrative_area_level_2', 'political']}, {'long_name': 'Toscana', 'short_name': 'Toscana', 'types': ['administrative_area_level_1', 'political']}, {'long_name': 'Italy', 'short_name': 'IT', 'types': ['country', 'political']}, {'long_name': '50123', 'short_name': '50123', 'types': ['postal_code']}]","[{'author_name': 'Fred Jaeger', 'author_url': 'https://www.google.com/maps/contrib/100358949698860473153/reviews', 'language': 'en', 'original_language': 'en', 'profile_photo_url': 'https://lh3.googleusercontent.com/a-/ALV-UjVhKDEnkfaUWRPfPXRrjIugisiuvJiIHfS_KBJApDZD7FI5co98=s128-c0x00000000-cc-rp-mo-ba5', 'rating': 5, 'relative_time_description': '3 months ago', 'text': 'Good place to grab affordable water quickly.', 'time': 1722056160, 'translated': False}, {'author_name': 'Jon Marshall', 'author_url': 'https://www.google.com/maps/contrib/115274216273096738195/reviews', 'language': 'en', 'original_language': 'en', 'profile_photo_url': 'https://lh3.googleusercontent.com/a/ACg8ocL6ZnTrtPX-1nqOsxcdiYQsaqOjMeeln29DTwBNMe_bLOriIA=s128-c0x00000000-cc-rp-mo', 'rating': 1, 'relative_time_description': '4 months ago', 'text': 'Horrible customer service and extremely rude staff. This was our first time going to the store and found ourselves at a lost on how to exist the store. When we inquired on it, a balding man yelled at us telling us that ""you know that is not how you exit a store, it\'s the same everywhere in the world"" which is incredibly false, arrogant, and ignorant of the man. Having been to numerous stores in numerous countries, never have a ever had to enter one side and go around the entire damn store to exit it. From then on he eyed us down as we made the entire round trip to eventually exit the store. Overall an extremely disappointing experience and would not recommend anyone outside of regulars to shop at this establishment unless you enjoy being berated by arrogant and hostile staff.', 'time': 1720115947, 'translated': False}, {'author_name': 'Eman Mohamed', 'author_url': 'https://www.google.com/maps/contrib/117326313782249589082/reviews', 'language': 'en', 'original_language': 'en', 'profile_photo_url': 'https://lh3.googleusercontent.com/a-/ALV-UjWAj_9sZ1jKIRNDCuQ7K0VrzyEX5NjfURJSPMV9Eh67OWlsz6ZKQQ=s128-c0x00000000-cc-rp-mo-ba4', 'rating': 5, 'relative_time_description': '3 weeks ago', 'text': 'Amazing service, sales girls were really nice, helpful and creative 👌', 'time': 1730484074, 'translated': False}, {'author_name': 'Cloe “Cloclo” Vang', 'author_url': 'https://www.google.com/maps/contrib/104533441517583303842/reviews', 'language': 'en', 'original_language': 'en', 'profile_photo_url': 'https://lh3.googleusercontent.com/a/ACg8ocL7thpw5Vbgl9ZWn0hHlkCiz-bQ-qgPsVhoLbT4pgxAxagqeA=s128-c0x00000000-cc-rp-mo', 'rating': 1, 'relative_time_description': '4 months ago', 'text': 'The two cashier ladies were so rude!  I went to this grocery store at least 5 times during my visit and each time the same two cashiers never appeared to be friendly toward anyone.  The only reason I continued to go there was because my airb&b is 3 minutes walk from this place.  I’m giving this place a 1 star because of how rude the cashiers were.', 'time': 1720338990, 'translated': False}, {'author_name': 'Charles Miers', 'author_url': 'https://www.google.com/maps/contrib/108894250435936412396/reviews', 'language': 'en', 'original_language': 'en', 'profile_photo_url': 'https://lh3.googleusercontent.com/a-/ALV-UjVL-I-HqHRkf4Q8V0cT3Pe1XHp7i9E9Tw8yxWtMaWgpHHC2IsWyXQ=s128-c0x00000000-cc-rp-mo-ba6', 'rating': 5, 'relative_time_description': '2 years ago', 'text': 'Nice grocery store.  Good wine selection, fresh fruit, fresh meat . . . every thing you need in a grocery store.', 'time': 1638697498, 'translated': False}]"
16,SAPORI & DINTORNI STORE,,https://www.google.com/maps/place/SAPORI+%26+DINTORNI+STORE/data=!4m2!3m1!1s0x133b085515daa667:0xfb8fea2f759fb01b,,ChIJEciBNwJUKhMRd2jclksddmU,SAPORI & DINTORNI STORE,"['supermarket', 'grocery_or_supermarket', 'food', 'point_of_interest', 'store', 'establishment']","Borgo S. Lorenzo, 15/17, 50123 Firenze FI, Italy","['Monday: 8:00\u202fAM\u2009–\u20099:00\u202fPM', 'Tuesday: 8:00\u202fAM\u2009–\u20099:00\u202fPM', 'Wednesday: 8:00\u202fAM\u2009–\u20099:00\u202fPM', 'Thursday: 8:00\u202fAM\u2009–\u20099:00\u202fPM', 'Friday: 8:00\u202fAM\u2009–\u20099:00\u202fPM', 'Saturday: 8:00\u202fAM\u2009–\u20099:00\u202fPM', 'Sunday: 9:00\u202fAM\u2009–\u20099:00\u202fPM']",4.1,https://www.conad.it/ricerca-negozi/sapori--dintorni-store-borgo-san-lorenzo-15-17-50123-firenze--008920,934.0,,"[{'long_name': '17', 'short_name': '17', 'types': ['subpremise']}, {'long_name': '15', 'short_name': '15', 'types': ['street_number']}, {'long_name': 'Borgo San Lorenzo', 'short_name': 'Borgo S. Lorenzo', 'types': ['route']}, {'long_name': 'Firenze', 'short_name': 'Firenze', 'types': ['locality', 'political']}, {'long_name': 'Firenze', 'short_name': 'Firenze', 'types': ['administrative_area_level_3', 'political']}, {'long_name': 'Città Metropolitana di Firenze', 'short_name': 'FI', 'types': ['administrative_area_level_2', 'political']}, {'long_name': 'Toscana', 'short_name': 'Toscana', 'types': ['administrative_area_level_1', 'political']}, {'long_name': 'Italy', 'short_name': 'IT', 'types': ['country', 'political']}, {'long_name': '50123', 'short_name': '50123', 'types': ['postal_code']}]","[{'author_name': 'Fred Jaeger', 'author_url': 'https://www.google.com/maps/contrib/100358949698860473153/reviews', 'language': 'en', 'original_language': 'en', 'profile_photo_url': 'https://lh3.googleusercontent.com/a-/ALV-UjVhKDEnkfaUWRPfPXRrjIugisiuvJiIHfS_KBJApDZD7FI5co98=s128-c0x00000000-cc-rp-mo-ba5', 'rating': 5, 'relative_time_description': '3 months ago', 'text': 'Good place to grab affordable water quickly.', 'time': 1722056160, 'translated': False}, {'author_name': 'Jon Marshall', 'author_url': 'https://www.google.com/maps/contrib/115274216273096738195/reviews', 'language': 'en', 'original_language': 'en', 'profile_photo_url': 'https://lh3.googleusercontent.com/a/ACg8ocL6ZnTrtPX-1nqOsxcdiYQsaqOjMeeln29DTwBNMe_bLOriIA=s128-c0x00000000-cc-rp-mo', 'rating': 1, 'relative_time_description': '4 months ago', 'text': 'Horrible customer service and extremely rude staff. This was our first time going to the store and found ourselves at a lost on how to exist the store. When we inquired on it, a balding man yelled at us telling us that ""you know that is not how you exit a store, it\'s the same everywhere in the world"" which is incredibly false, arrogant, and ignorant of the man. Having been to numerous stores in numerous countries, never have a ever had to enter one side and go around the entire damn store to exit it. From then on he eyed us down as we made the entire round trip to eventually exit the store. Overall an extremely disappointing experience and would not recommend anyone outside of regulars to shop at this establishment unless you enjoy being berated by arrogant and hostile staff.', 'time': 1720115947, 'translated': False}, {'author_name': 'Eman Mohamed', 'author_url': 'https://www.google.com/maps/contrib/117326313782249589082/reviews', 'language': 'en', 'original_language': 'en', 'profile_photo_url': 'https://lh3.googleusercontent.com/a-/ALV-UjWAj_9sZ1jKIRNDCuQ7K0VrzyEX5NjfURJSPMV9Eh67OWlsz6ZKQQ=s128-c0x00000000-cc-rp-mo-ba4', 'rating': 5, 'relative_time_description': '3 weeks ago', 'text': 'Amazing service, sales girls were really nice, helpful and creative 👌', 'time': 1730484074, 'translated': False}, {'author_name': 'Cloe “Cloclo” Vang', 'author_url': 'https://www.google.com/maps/contrib/104533441517583303842/reviews', 'language': 'en', 'original_language': 'en', 'profile_photo_url': 'https://lh3.googleusercontent.com/a/ACg8ocL7thpw5Vbgl9ZWn0hHlkCiz-bQ-qgPsVhoLbT4pgxAxagqeA=s128-c0x00000000-cc-rp-mo', 'rating': 1, 'relative_time_description': '4 months ago', 'text': 'The two cashier ladies were so rude!  I went to this grocery store at least 5 times during my visit and each time the same two cashiers never appeared to be friendly toward anyone.  The only reason I continued to go there was because my airb&b is 3 minutes walk from this place.  I’m giving this place a 1 star because of how rude the cashiers were.', 'time': 1720338990, 'translated': False}, {'author_name': 'Charles Miers', 'author_url': 'https://www.google.com/maps/contrib/108894250435936412396/reviews', 'language': 'en', 'original_language': 'en', 'profile_photo_url': 'https://lh3.googleusercontent.com/a-/ALV-UjVL-I-HqHRkf4Q8V0cT3Pe1XHp7i9E9Tw8yxWtMaWgpHHC2IsWyXQ=s128-c0x00000000-cc-rp-mo-ba6', 'rating': 5, 'relative_time_description': '2 years ago', 'text': 'Nice grocery store.  Good wine selection, fresh fruit, fresh meat . . . every thing you need in a grocery store.', 'time': 1638697498, 'translated': False}]"
17,London Outlet Store,,https://www.google.com/maps/place/London+Outlet+Store/data=!4m2!3m1!1s0x133b09ffe9cb9051:0xe7c37f33ab24af7,,ChIJ87dPzioSdkgRsew1fJHs0Uw,London Designer Outlet,"['shopping_mall', 'point_of_interest', 'establishment']","Wembley Park Blvd, Wembley Park, Wembley HA9 0FD, UK","['Monday: 10:00\u202fAM\u2009–\u20098:00\u202fPM', 'Tuesday: 10:00\u202fAM\u2009–\u20098:00\u202fPM', 'Wednesday: 10:00\u202fAM\u2009–\u20098:00\u202fPM', 'Thursday: 10:00\u202fAM\u2009–\u20098:00\u202fPM', 'Friday: 10:00\u202fAM\u2009–\u20098:00\u202fPM', 'Saturday: 10:00\u202fAM\u2009–\u20098:00\u202fPM', 'Sunday: 11:00\u202fAM\u2009–\u20097:00\u202fPM']",4.3,http://www.londondesigneroutlet.com/?utm_source=googe_business&utm_medium=organic,21926.0,,"[{'long_name': 'Wembley Park Boulevard', 'short_name': 'Wembley Park Blvd', 'types': ['route']}, {'long_name': 'Wembley Park', 'short_name': 'Wembley Park', 'types': ['sublocality_level_1', 'sublocality', 'political']}, {'long_name': 'Wembley', 'short_name': 'Wembley', 'types': ['postal_town']}, {'long_name': 'Greater London', 'short_name': 'Greater London', 'types': ['administrative_area_level_2', 'political']}, {'long_name': 'England', 'short_name': 'England', 'types': ['administrative_area_level_1', 'political']}, {'long_name': 'United Kingdom', 'short_name': 'GB', 'types': ['country', 'political']}, {'long_name': 'HA9 0FD', 'short_name': 'HA9 0FD', 'types': ['postal_code']}]","[{'author_name': 'Oluwayomi Oni', 'author_url': 'https://www.google.com/maps/contrib/114343008572613504387/reviews', 'language': 'en', 'original_language': 'en', 'profile_photo_url': 'https://lh3.googleusercontent.com/a-/ALV-UjURCnSTHTI2jSIWfXhkwxCcXbaPluNOTTLQQABkNhjhxivlPiWu=s128-c0x00000000-cc-rp-mo-ba6', 'rating': 5, 'relative_time_description': '4 months ago', 'text': 'All shops combined in one at the London Designer Outlet in Wembley (next to the prestigious Wembley Stadium). The whole area has been beautified and has been adaptable to be as diverse as possible. There’s parking, food for the kids and pay if they want. What else are you asking for within Wembley. You’ve got it here!', 'time': 1721231317, 'translated': False}, {'author_name': 'Fernando Torres', 'author_url': 'https://www.google.com/maps/contrib/103893102070343410755/reviews', 'language': 'en', 'original_language': 'en', 'profile_photo_url': 'https://lh3.googleusercontent.com/a-/ALV-UjUHT0s8V1WltkGmYq-PfwxiEOrejOf67Ou0JllbY0571n6Isvp1=s128-c0x00000000-cc-rp-mo-ba4', 'rating': 5, 'relative_time_description': '3 months ago', 'text': 'If you are patient, you will find very good deals. Overall, it is worth a visit. You might get 30% off in the majority of the products and sometimes 50%. But the best part is when you find the orange label price. It is about 70% off or more. Check the pictures below.', 'time': 1724586409, 'translated': False}, {'author_name': 'MagenKalis', 'author_url': 'https://www.google.com/maps/contrib/115814385336754908296/reviews', 'language': 'en', 'original_language': 'en', 'profile_photo_url': 'https://lh3.googleusercontent.com/a-/ALV-UjVh8zJrr_MPBhQEpngq0Eb8y2yRN8ntEeIgtE0RfoAvB2VDiRRU=s128-c0x00000000-cc-rp-mo-ba5', 'rating': 5, 'relative_time_description': '4 months ago', 'text': 'Close to Wembley Stadium..\nAffordable shopping place to hunt for cheap branded apparels and shoes.\nAn alternative for  JD Outlet..\nThough the entire place is a bit quite small.\nMany outlets are operating at this place..\nThe prices were reasonable, with plenty of good choices..', 'time': 1719578336, 'translated': False}, {'author_name': 'Sam Aberman', 'author_url': 'https://www.google.com/maps/contrib/111941996399252793572/reviews', 'language': 'en', 'original_language': 'en', 'profile_photo_url': 'https://lh3.googleusercontent.com/a-/ALV-UjWW8LD98tdvZGX2GSpZHvoTTtCKd8qb17YM2nQsTU6mmb_xz9uN7Q=s128-c0x00000000-cc-rp-mo-ba8', 'rating': 5, 'relative_time_description': '8 months ago', 'text': ""I recently visited the Wembley Designer Outlet on a sunny weekday and was pleasantly surprised by the open layout, which made for an enjoyable shopping experience. The clean and well-maintained premises added to the overall appeal.\n\nOne of the highlights of the outlet is the good selection of restaurants, offering a variety of cuisines to suit different tastes. This makes it easy to take a break from shopping and grab a bite to eat.\n\nHowever, I would advise against visiting on weekends, as it can get extremely busy, making it difficult to navigate the shops and find what you're looking for. The crowds can be overwhelming, detracting from the overall experience.\n\nWhile the outlet boasts a range of stores, I couldn't help but notice that there was an overabundance of shoe shops and not enough variety in terms of fashion. This might be disappointing for those seeking a more diverse shopping experience.\n\nThat being said, with a bit of patience and persistence, there are indeed bargains to be found. Many shops offer discounted prices on popular brands, making it worth the effort to hunt for good deals.\n\nIn summary, the Wembley Designer Outlet is a decent shopping destination, particularly on a nice day when you can enjoy the open layout. Just be prepared for crowds on weekends and a somewhat limited fashion selection. If you're primarily looking for shoes or don't mind the lack of variety, you may find some great bargains here."", 'time': 1711646947, 'translated': False}, {'author_name': 'Jeevith Narayanan', 'author_url': 'https://www.google.com/maps/contrib/117483816576684590117/reviews', 'language': 'en', 'original_language': 'en', 'profile_photo_url': 'https://lh3.googleusercontent.com/a-/ALV-UjXURMVnJjsk4GV_uQvK2UJNl7fYViaGX8upNosp6U9rwN6DU3SP=s128-c0x00000000-cc-rp-mo-ba4', 'rating': 5, 'relative_time_description': '4 months ago', 'text': 'I had an excellent experience at the London Designer Outlet! 🛍️ The variety of stores is impressive, featuring top brands at fantastic prices. All the stores had sales, making the already discounted prices even more attractive. 🤑\n\nThe shopping environment is clean, modern, and welcoming, making it a pleasure to browse and shop. 🏬 The food court offers a great selection of dining options, perfect for taking a break and refueling during a shopping spree. 🍔☕ The staff in the stores are friendly and helpful, providing excellent customer service. 😊 Additionally, the location is convenient, with ample parking and easy access to public transport. 🚗🚇\n\nOverall, the London Designer Outlet is a must-visit for anyone looking to enjoy a day of shopping and dining at unbeatable prices. Highly recommend! 🌟', 'time': 1721773931, 'translated': False}]"
