,Título,Nota,URL,Comentar,id,name,types,formatted_address,opening_hours,rating,website,user_ratings_total,price_level,address_components,reviews
0,Restaurante Cepa,,https://www.google.com/maps/place/Restaurante+Cepa/data=!4m2!3m1!1s0x94ce5f2a9dc734f3:0x4332e68ccb6312d0,,ChIJ8zTHnSpfzpQR0BJjy4zmMkM,Restaurante Cepa,"['restaurant', 'food', 'point_of_interest', 'establishment']","Praça dos Omaguás, 110 - Pinheiros, São Paulo - SP, 05419-020, Brazil","['Monday: Closed', 'Tuesday: Closed', 'Wednesday: 7:00\u2009–\u200911:00\u202fPM', 'Thursday: 7:00\u2009–\u200911:00\u202fPM', 'Friday: 7:00\u2009–\u200911:00\u202fPM', 'Saturday: 12:00\u2009–\u20094:00\u202fPM, 7:00\u2009–\u200911:00\u202fPM', 'Sunday: 12:00\u2009–\u20094:00\u202fPM']",4.4,,446.0,,"[{'long_name': '110', 'short_name': '110', 'types': ['street_number']}, {'long_name': 'Praça dos Omaguás', 'short_name': 'Praça dos Omaguás', 'types': ['route']}, {'long_name': 'Pinheiros', 'short_name': 'Pinheiros', 'types': ['sublocality_level_1', 'sublocality', 'political']}, {'long_name': 'São Paulo', 'short_name': 'São Paulo', 'types': ['administrative_area_level_2', 'political']}, {'long_name': 'São Paulo', 'short_name': 'SP', 'types': ['administrative_area_level_1', 'political']}, {'long_name': 'Brazil', 'short_name': 'BR', 'types': ['country', 'political']}, {'long_name': '05419-020', 'short_name': '05419-020', 'types': ['postal_code']}]","[{'author_name': 'Andrés Suárez', 'author_url': 'https://www.google.com/maps/contrib/107838955068237376222/reviews', 'language': 'en', 'original_language': 'en', 'profile_photo_url': 'https://lh3.googleusercontent.com/a-/ALV-UjUQfBrPkCY9bNyRPjd3llid0c_3YgAtaM0EJxj5Dj6Z6Yjo1fMe=s128-c0x00000000-cc-rp-mo-ba6', 'rating': 4, 'relative_time_description': '5 years ago', 'text': 'Fantastic. The concept of the restaurant is to have everything produced by small producers.  Moreover, they produce their own burrata, compote and jams. they cure their own meats.  Service is very good.  my whiskey sour was fantastic. Wine available is from small producers and biodynamic.\nMy one complaint: my deassert was meant to be  with kefir ice cream', 'time': 1573352861, 'translated': False}, {'author_name': 'Greg nyc', 'author_url': 'https://www.google.com/maps/contrib/104560537304310946511/reviews', 'language': 'en', 'original_language': 'en', 'profile_photo_url': 'https://lh3.googleusercontent.com/a/ACg8ocLrPeSoITPkyPRAWOstSPUBk10fWj2Nzwbdcf7QnJmsQyDgLw=s128-c0x00000000-cc-rp-mo-ba4', 'rating': 5, 'relative_time_description': '3 years ago', 'text': ""Absolutely marvelous, can't wait to return. Lovely charming staff, food is terrific, executive menu selection is a great value (we ran up the bill with lots of extras). Highest recommendation"", 'time': 1627758223, 'translated': False}, {'author_name': 'Ricardo Gabriel', 'author_url': 'https://www.google.com/maps/contrib/113849772360780248785/reviews', 'language': 'en', 'original_language': 'en', 'profile_photo_url': 'https://lh3.googleusercontent.com/a-/ALV-UjXAh9P_yDFdUxnANrdsQz6ZnemvVkPp0izLpPwSZPGtTQ4cNJNu=s128-c0x00000000-cc-rp-mo-ba4', 'rating': 5, 'relative_time_description': '2 years ago', 'text': ""Good service, delicious food. It's great if you call early to get a reservation."", 'time': 1648389177, 'translated': False}, {'author_name': 'Raphael Martinez', 'author_url': 'https://www.google.com/maps/contrib/113569506288922191650/reviews', 'language': 'en', 'original_language': 'en', 'profile_photo_url': 'https://lh3.googleusercontent.com/a-/ALV-UjV9phPMYelu9V8ZqsmsgDYOPoE_J9wfQeJAI_N_M6zBF63R6oFI=s128-c0x00000000-cc-rp-mo-ba4', 'rating': 5, 'relative_time_description': '5 years ago', 'text': ""Lovely place with it's original menu in which almost everything are made there from scratch like yeast, bread and sausages. I definitely recommend going during the week for lunch and you can get the executive menu that offer excellent quality dishes with affordable prices. Please do not miss the ginger and lemon drink with sparkling water."", 'time': 1562091260, 'translated': False}, {'author_name': 'Tatiane Moreira', 'author_url': 'https://www.google.com/maps/contrib/107570816901970261948/reviews', 'language': 'en', 'original_language': 'en', 'profile_photo_url': 'https://lh3.googleusercontent.com/a/ACg8ocJRvrDQ2KR-2FdxfJusJ0ky6hz_puRXQi6p2rL5_b7ZRDuvvA=s128-c0x00000000-cc-rp-mo', 'rating': 5, 'relative_time_description': '5 years ago', 'text': 'What an amazing experience! This restaurant is one of the best foods i have ever eaten in Sao Paulo.. if you like Wine and amazing food definitely check this place out!\nOwners have a great customer service! The chef Lucas has a great taste in his food and puts all his heart and soul into his cooking!\nGabrielli has a amazing knowledge of all the wines. The atmosphere is cozy and comfortable!! If i could i would give 1000 stars!!! Keep up the good work guys\n!', 'time': 1552963142, 'translated': False}]"
1,Lobozó Restaurante,,https://www.google.com/maps/place/Loboz%C3%B3+Restaurante/data=!4m2!3m1!1s0x94ce571b3a3a6517:0x502d9102b836cb79,,ChIJF2U6OhtXzpQRecs2uAKRLVA,Lobozó Restaurante,"['restaurant', 'food', 'point_of_interest', 'establishment']","R. Medeiros de Albuquerque, 436 - Vila Madalena, São Paulo - SP, 05436-060, Brazil","['Monday: 12:00\u2009–\u20094:30\u202fPM', 'Tuesday: Closed', 'Wednesday: 12:00\u2009–\u20094:30\u202fPM', 'Thursday: 12:00\u2009–\u20094:30\u202fPM, 7:00\u2009–\u200911:00\u202fPM', 'Friday: 12:00\u2009–\u200911:00\u202fPM', 'Saturday: 12:00\u2009–\u200911:00\u202fPM', 'Sunday: 12:00\u2009–\u20094:30\u202fPM']",4.4,http://www.lobozo.com.br/,530.0,2.0,"[{'long_name': '436', 'short_name': '436', 'types': ['street_number']}, {'long_name': 'Rua Medeiros de Albuquerque', 'short_name': 'R. Medeiros de Albuquerque', 'types': ['route']}, {'long_name': 'Vila Madalena', 'short_name': 'Vila Madalena', 'types': ['sublocality_level_1', 'sublocality', 'political']}, {'long_name': 'São Paulo', 'short_name': 'São Paulo', 'types': ['administrative_area_level_2', 'political']}, {'long_name': 'São Paulo', 'short_name': 'SP', 'types': ['administrative_area_level_1', 'political']}, {'long_name': 'Brazil', 'short_name': 'BR', 'types': ['country', 'political']}, {'long_name': '05436-060', 'short_name': '05436-060', 'types': ['postal_code']}]","[{'author_name': 'Fifo', 'author_url': 'https://www.google.com/maps/contrib/107376152181103214875/reviews', 'language': 'en', 'original_language': 'en', 'profile_photo_url': 'https://lh3.googleusercontent.com/a-/ALV-UjXfg5QNL59Ww_W77mMeiBFepQRxcwSsEgYI1hVH57k38PiIf9Y=s128-c0x00000000-cc-rp-mo-ba5', 'rating': 4, 'relative_time_description': '4 months ago', 'text': 'Great place with strong drinks and nice food.\nThey are well known for their chicken - so make sire to order that. But also get some of their great starts to share.', 'time': 1720190641, 'translated': False}, {'author_name': 'Elin Petev', 'author_url': 'https://www.google.com/maps/contrib/112753378823266717678/reviews', 'language': 'en', 'original_language': 'en', 'profile_photo_url': 'https://lh3.googleusercontent.com/a-/ALV-UjVj1RnBCJo4LmaK3pYZ3Wemqxh6GteAPWGnTPLJRh_Jphd-FD1L=s128-c0x00000000-cc-rp-mo-ba5', 'rating': 5, 'relative_time_description': 'a year ago', 'text': ""What a great find l I  the heart of Sao Paulo!\nThe place was extremely busy when we got there but the guys were quick to organise a table for us.\nOur waiter Sebastian was amazing, he knew the menu the place and what he was doing.\nThe drinks took a little wile to come out however they were delicious.\n\nThe place has an opened kitche  with means you get to see the action happening before you.\n\nThe chefs were well organised and were dishing out plates like it's  no ones business.\n\nSpeaking of the chefs, the food was outstanding, I haven't had such good food in a good while!\n\nIf you're in the area, definitely give it a go, you won't regret it!"", 'time': 1672083186, 'translated': False}, {'author_name': 'Bruna Carvalho', 'author_url': 'https://www.google.com/maps/contrib/114093644864401679334/reviews', 'language': 'en', 'original_language': 'en', 'profile_photo_url': 'https://lh3.googleusercontent.com/a-/ALV-UjWAglT1d274-U0IBaaHLpuoKy3Q53KfWmcKzcZs4Cse6zecP7dAeg=s128-c0x00000000-cc-rp-mo-ba5', 'rating': 4, 'relative_time_description': '2 years ago', 'text': 'It’s pricy, but the food is great! Different than the usual options you find in São Paulo. Super well prepared, the space is not too big, but for a lunch during a weekday it was easy for us to find a table. I liked it a lot, the beer was not my favorite.', 'time': 1668213136, 'translated': False}, {'author_name': 'Steinar Svenning', 'author_url': 'https://www.google.com/maps/contrib/110562334358212870682/reviews', 'language': 'en', 'original_language': 'en', 'profile_photo_url': 'https://lh3.googleusercontent.com/a-/ALV-UjUs50oE9-9H_Ymm7MJi7FfXjSOG9qZH-5Gk1bQrsBeCjUsZEDU_5g=s128-c0x00000000-cc-rp-mo-ba4', 'rating': 5, 'relative_time_description': '2 years ago', 'text': 'Brazilian cuisine has a peak in the traditional cuisine of chef Gustavo. A delightful serving of original Brazilian recipes. Staff keeps a extraordinary focused eye on details. For me this amazingly good restaurant is really giving Casa de Porco a good run for its money.', 'time': 1657972261, 'translated': False}, {'author_name': 'Alexis', 'author_url': 'https://www.google.com/maps/contrib/104467121975651141427/reviews', 'language': 'en', 'original_language': 'en', 'profile_photo_url': 'https://lh3.googleusercontent.com/a-/ALV-UjVWhyXJRtGtLV6qYijWLRmeDSSjgL5tsEn9itY2pQKV5kenU4s=s128-c0x00000000-cc-rp-mo-ba4', 'rating': 3, 'relative_time_description': 'a year ago', 'text': 'I really wanted to like it more, but my rotisserie chicken was rather dry than moist. The sides were tasteful. I would give it a second chance, but the first visit wasn’t on point.', 'time': 1691496559, 'translated': False}]"
2,Plou Vinhos,,https://www.google.com/maps/place/Plou+Vinhos/data=!4m2!3m1!1s0x94ce570025cdfc2d:0x478eb30e4bd31750,,ChIJLfzNJQBXzpQRUBfTSw6zjkc,Plou Vinhos,"['bar', 'point_of_interest', 'establishment']","R. Original, 141 - Sumarezinho, São Paulo - SP, 05435-050, Brazil","['Monday: Closed', 'Tuesday: 10:00\u202fAM\u2009–\u200911:00\u202fPM', 'Wednesday: 10:00\u202fAM\u2009–\u200911:00\u202fPM', 'Thursday: 10:00\u202fAM\u2009–\u200911:00\u202fPM', 'Friday: 11:00\u202fAM\u2009–\u200912:00\u202fAM', 'Saturday: 11:00\u202fAM\u2009–\u200912:00\u202fAM', 'Sunday: 1:00\u2009–\u20098:00\u202fPM']",4.6,https://www.instagram.com/plou.vinhos,13.0,,"[{'long_name': '141', 'short_name': '141', 'types': ['street_number']}, {'long_name': 'Rua Original', 'short_name': 'R. Original', 'types': ['route']}, {'long_name': 'Sumarezinho', 'short_name': 'Sumarezinho', 'types': ['sublocality_level_1', 'sublocality', 'political']}, {'long_name': 'São Paulo', 'short_name': 'São Paulo', 'types': ['administrative_area_level_2', 'political']}, {'long_name': 'São Paulo', 'short_name': 'SP', 'types': ['administrative_area_level_1', 'political']}, {'long_name': 'Brazil', 'short_name': 'BR', 'types': ['country', 'political']}, {'long_name': '05435-050', 'short_name': '05435-050', 'types': ['postal_code']}]","[{'author_name': 'Rodolfo Arouca', 'author_url': 'https://www.google.com/maps/contrib/111544286639190345926/reviews', 'language': 'pt', 'original_language': 'pt', 'profile_photo_url': 'https://lh3.googleusercontent.com/a-/ALV-UjWsRxQz7_0tR11hyqcBkdsNwYniq6f-r0J0WA33h5AecxhBi_LR=s128-c0x00000000-cc-rp-mo-ba4', 'rating': 5, 'relative_time_description': 'a week ago', 'text': 'Já pensou entrar em um ambiente aconchegante e encontrar um bar de vinhos onde a Proprietaria (Analu Torres) apresenta mais de 18 rótulos em taça de cabeça? Contando um pouco de cada um sem ler de um cardápio e ainda falando cada preço (ideia ótima que evita qualquer tipo de constrangimento de vc querer pedir um vinho pq gostou da descrição e descobre que custa 120 reais a taça) - aliás é nítida a preocupação com diferentes faixas de preço, começando com valores tão baixos quanto 38 reais pra taça e garrafas com bom custo benefício. Várias opções de vinhos franceses, mas também espanholas, croatas e etc. Analu e demais pessoas que estavam trabalhando lá todas com uma paixão incrível por vinho e fazendo tudo para que a nossa experiência fosse ótima.\n\nQuem melhor do que pessoas apaixonadas de vinho para indicar vinhos, né?\n\nO cardápio de comidas é enxuto, mas opções perfeitas para beliscar ou até comer enquanto aprecia-se os vinhos. Preços também justos, tábua de queijos e de charcuterie deliciosas com valores de 38 e 44 reais respectivamente. Não são grandes, mas essas duas serviram bem 3 pessoas.\n\nPoderia dizer que existem “4” ambientes, por mais que não haja uma grande ruptura entre eles. A área de fora antes de entrar, que imagino que num dia de muito movimento vc possa sentar em uma cadeirinha de praia ou ficar de pé, o salão principal com opções de cadeira com mesa e até um sofazinho, o bar em si com cerca de 8 lugares, e um corredor lateral externo com bancadas altas pra degustar um vinho em pé enquanto joga conversa fora.\n\nA playlist estava ótima, músicas variadas principalmente anos 80-90. Volume ideal pra quebrar o silêncio intimidador, mas sem atrapalhar a conversa.\n\nTodo o cuidado na curadoria das peças de decoração e no design também aparece. O logo é um charme por si só.\n\nExistem várias opções de bares de vinho em São Paulo, mas o Plou me surpreendeu pelo atendimento, qualidade e custo benefício. Tem tudo pra ser meu favorito, preciso voltar mais vezes pra tirar a prova.', 'time': 1731767216, 'translated': False}, {'author_name': 'Jacomo Piccolini', 'author_url': 'https://www.google.com/maps/contrib/101673922892549246764/reviews', 'language': 'pt', 'original_language': 'pt', 'profile_photo_url': 'https://lh3.googleusercontent.com/a-/ALV-UjXCST6gewQIi9NYEHBjkN57EqL1v4JRAq2eevXWcqLO8q2ih25akw=s128-c0x00000000-cc-rp-mo-ba5', 'rating': 5, 'relative_time_description': '3 months ago', 'text': 'Plou Vinhos Naturais, o melhor ambiente para uma taça ou garrafa de vinhos naturais e um acompanhamento pra beliscar! Analu com um conhecimento único sobre vinhos! Equipe super competente e sensacional!', 'time': 1723775480, 'translated': False}, {'author_name': 'Daniela Christine', 'author_url': 'https://www.google.com/maps/contrib/101967049458609181531/reviews', 'language': 'pt', 'original_language': 'pt', 'profile_photo_url': 'https://lh3.googleusercontent.com/a-/ALV-UjUZZF7QzGIf27T8-Qggj1Bd-l-wgVNDC1blioI5HVn4vcDBzp9y=s128-c0x00000000-cc-rp-mo-ba4', 'rating': 5, 'relative_time_description': '3 months ago', 'text': 'Fui conhecer o novo espaço mas estava sendo realizado um evento de degustação de vinhos e ainda não tinham as porções e pratos, portanto não deu para avaliar. Vou voltar posteriormente para experimentar. A princípio adianto que amei o local. Bem descontraído mas com uma decoração de muito bom gosto, o espaço não é muito grande mas é aconchegante e ainda tem um banco e aparadores na calçada (onde fiquei pois o dia estava quente e estava bem cheio mas curti mesmo assim).', 'time': 1724016823, 'translated': False}, {'author_name': 'Bruno Szczypkovski', 'author_url': 'https://www.google.com/maps/contrib/115652807623655183953/reviews', 'language': 'pt', 'original_language': 'pt', 'profile_photo_url': 'https://lh3.googleusercontent.com/a/ACg8ocK1Ny2ICF7OBhZ0GB5S2HaRhiJJqBtBM30e6z52iXuFIz191JA=s128-c0x00000000-cc-rp-mo', 'rating': 5, 'relative_time_description': 'a month ago', 'text': 'Lugar lindo, aconchegante e com uma carta de vinhos invejável. Certamente é mais uma coluna importante para a evolução do mercado do bom vinho no Brasil. Parabéns pela coragem e pela dedicação.', 'time': 1727902103, 'translated': False}, {'author_name': 'Mike Zambotto', 'author_url': 'https://www.google.com/maps/contrib/117002067422808541642/reviews', 'language': 'pt', 'original_language': 'pt', 'profile_photo_url': 'https://lh3.googleusercontent.com/a-/ALV-UjWXg1wqcUo_V-A4L72oPUbfQXBqlEkxSYST2E18OyS_GlyZjHyC=s128-c0x00000000-cc-rp-mo', 'rating': 1, 'relative_time_description': '2 months ago', 'text': 'Percebi um tratamento bem desdenhado pela tal da Analu pelo simples fato de eu ter dito que gosto de Chardonnay. Entendo que vinho bom é aquele que te agrada, independentemente de origem, preço, uva.', 'time': 1726187338, 'translated': False}]"
3,La Boutique del Tartufo,,https://www.google.com/maps/place/La+Boutique+del+Tartufo/data=!4m2!3m1!1s0x4786c70fa322debf:0xb43dde5cdff17d98,,ChIJv94iow_HhkcRmH3x31zePbQ,La Boutique del Tartufo,"['store', 'point_of_interest', 'establishment']","Via Lazzaro Spallanzani, 18, 20124 Milano MI, Italy","['Monday: 10:00\u202fAM\u2009–\u20092:00\u202fPM, 3:00\u2009–\u20097:00\u202fPM', 'Tuesday: 10:00\u202fAM\u2009–\u20092:00\u202fPM, 3:00\u2009–\u20097:00\u202fPM', 'Wednesday: 10:00\u202fAM\u2009–\u20092:00\u202fPM, 3:00\u2009–\u20097:00\u202fPM', 'Thursday: 10:00\u202fAM\u2009–\u20092:00\u202fPM, 3:00\u2009–\u20097:00\u202fPM', 'Friday: 10:00\u202fAM\u2009–\u20092:00\u202fPM, 3:00\u2009–\u20097:00\u202fPM', 'Saturday: 10:00\u202fAM\u2009–\u20092:00\u202fPM, 3:00\u2009–\u20098:00\u202fPM', 'Sunday: 11:00\u202fAM\u2009–\u20092:00\u202fPM, 3:00\u2009–\u20097:00\u202fPM']",4.9,http://laboutiquedeltartufo.it/,118.0,,"[{'long_name': '18', 'short_name': '18', 'types': ['street_number']}, {'long_name': 'Via Lazzaro Spallanzani', 'short_name': 'Via Lazzaro Spallanzani', 'types': ['route']}, {'long_name': 'Milano', 'short_name': 'Milano', 'types': ['locality', 'political']}, {'long_name': 'Milano', 'short_name': 'Milano', 'types': ['administrative_area_level_3', 'political']}, {'long_name': 'Città metropolitana di Milano', 'short_name': 'MI', 'types': ['administrative_area_level_2', 'political']}, {'long_name': 'Lombardia', 'short_name': 'Lombardia', 'types': ['administrative_area_level_1', 'political']}, {'long_name': 'Italy', 'short_name': 'IT', 'types': ['country', 'political']}, {'long_name': '20124', 'short_name': '20124', 'types': ['postal_code']}]","[{'author_name': 'Lea Hoong', 'author_url': 'https://www.google.com/maps/contrib/108100374988020899622/reviews', 'language': 'en', 'original_language': 'en', 'profile_photo_url': 'https://lh3.googleusercontent.com/a/ACg8ocI2eGQgRlJ1N9ZkvkCiYf1-vi6KkHLTGF86sPbL5pv7X6ZQsA=s128-c0x00000000-cc-rp-mo', 'rating': 5, 'relative_time_description': '5 months ago', 'text': ""The staff was very friendly and we had a lot to talk about! There's a variety of options for truffle and she explained to me very well about the different varieties. Will definitely drop by again if I ever visit Milan"", 'time': 1719339263, 'translated': False}, {'author_name': 'Łukasz Wnęk', 'author_url': 'https://www.google.com/maps/contrib/105361674733446414572/reviews', 'language': 'en', 'original_language': 'en', 'profile_photo_url': 'https://lh3.googleusercontent.com/a-/ALV-UjXBQXaiGYy7Lviq01dHgqgOFXkfujgSSORakgv4iH8GtaZlGjXl=s128-c0x00000000-cc-rp-mo-ba3', 'rating': 5, 'relative_time_description': '5 months ago', 'text': 'This is for me the best food experience in Italy. High quality ingredients, extraordinary flavours, veeeery nice lady serving delicious food. This place should be included in Michelin guide.', 'time': 1719003736, 'translated': False}, {'author_name': 'Emily Lui', 'author_url': 'https://www.google.com/maps/contrib/115777433751331172922/reviews', 'language': 'en', 'original_language': 'en', 'profile_photo_url': 'https://lh3.googleusercontent.com/a/ACg8ocJxbhfqjfZC78ibILwD_aW-IsHrYkCYy_Pvdbsoxw5n8RECIg=s128-c0x00000000-cc-rp-mo', 'rating': 5, 'relative_time_description': '4 months ago', 'text': 'Carlotta was so knowledgeable and helpful. She made my experience at la boutique del tartufo very wonderful. I was able to get everything I wanted for souvenirs and was very satisfied with what I got', 'time': 1719848527, 'translated': False}, {'author_name': 'Tjinali', 'author_url': 'https://www.google.com/maps/contrib/106890733671825873778/reviews', 'language': 'en', 'original_language': 'en', 'profile_photo_url': 'https://lh3.googleusercontent.com/a-/ALV-UjWsRS8ymJNoU1X8ysJYKLQJ3nEPrLlVLHryed5jA2vypIsN-GyP=s128-c0x00000000-cc-rp-mo', 'rating': 5, 'relative_time_description': 'a month ago', 'text': 'Very nice lady that helped me. Bought a few products and I’m very excited to try! Really recommend', 'time': 1728140054, 'translated': False}, {'author_name': 'Gareth Lee', 'author_url': 'https://www.google.com/maps/contrib/111022809271041435419/reviews', 'language': 'en', 'original_language': 'en', 'profile_photo_url': 'https://lh3.googleusercontent.com/a/ACg8ocJQz5Byh0qsk50N-VX3hZHOo4ifd1RF83T8clboAxPXDay_KA=s128-c0x00000000-cc-rp-mo', 'rating': 5, 'relative_time_description': '4 months ago', 'text': 'Carlotta did a wonderful job introducing the products and the products were good quality.', 'time': 1719848483, 'translated': False}]"
